Frase,Parole chiave,Data,Sentiment,Sentiment risultato
"Hello FL! How are you?

For the few football fans who hang around here and who normally support the Blues, which team are you going to support for the Euro final?

We agree that the best thing would be Bane showing up to destroy the stadium and cancel the match, but otherwise? I have a hard time choosing.

Pro England:

- The Italians are our football rivals.
- We will have the excuse that they played everything at home.
- They would move to one euro, unlike Italy which would move to two and catch up with us.

Pro Italy:

- The English are our rivals in folklore, like Joan of Arc and the war of the English Channel fishermen.
- The English who have earned nothing for 50 years is funny and it should last.
- Italy offered a better game.

Sorry for the football spam for others!

Good day !","['football', 'would', 'Italy', 'English', 'support']",2021-07-08 10:58:42,"{'neg': 0.09, 'neu': 0.74, 'pos': 0.169, 'compound': 0.9248}",positive
"an eternal draw in which neither team manages to score to the point of calling the public into the stadium

7 days later, no goal has yet been scored, they decide to settle it in the kitchen, the English too proud and too smart have agreed to play the game

the English set fire to the kitchen, the cup melts in the kitchen

there will be no winner in this competition, only losers","['kitchen', 'English', 'eternal', 'draw', 'neither']",2021-07-08 11:41:26,"{'neg': 0.117, 'neu': 0.722, 'pos': 0.162, 'compound': 0.5994}",positive
"I'm not really into football but I would choose Italy. 2006 is too far away, and from what I understand they have a relatively young and recently formed team so it would be a consecration for them.

Oh and also I don't like English people.","['would', 'Im', 'really', 'football', 'choose']",2021-07-08 13:47:08,"{'neg': 0.064, 'neu': 0.936, 'pos': 0.0, 'compound': -0.395}",negative
I hated yesterday's match with the English. The English looked for faults excessively by throwing themselves to the ground. In particular the attacker who seeks the penalty by throwing himself to the ground each time he enters the penalty area. It looks like M'bappé.,"['English', 'throwing', 'ground', 'penalty', 'hated']",2021-07-08 12:15:16,"{'neg': 0.301, 'neu': 0.655, 'pos': 0.044, 'compound': -0.9382}",negative
"I share my office with three Italian women and a huge green, white and red flag flies above my head. I don't really have a choice","['share', 'office', 'three', 'Italian', 'women']",2021-07-08 12:53:31,"{'neg': 0.0, 'neu': 0.816, 'pos': 0.184, 'compound': 0.5423}",positive
"Italy, the English must gain nothing, nothing.","['nothing', 'Italy', 'English', 'must', 'gain']",2021-07-08 12:57:31,"{'neg': 0.0, 'neu': 0.638, 'pos': 0.362, 'compound': 0.5267}",positive
Italy 100%,"['Italy', '100']",2021-07-08 16:30:52,"{'neg': 0.0, 'neu': 1.0, 'pos': 0.0, 'compound': 0.0}",neutral
"I am for the Italians.

Well no, I will always be against the perfidious Albion, and for the guys who invented bresaola.","['Italians', 'Well', 'always', 'perfidious', 'Albion']",2021-07-08 11:55:31,"{'neg': 0.099, 'neu': 0.807, 'pos': 0.094, 'compound': -0.0258}",neutral
"The English are FDP of a corrupt UEFA

We're not going to let them dive home","['English', 'FDP', 'corrupt', 'UEFA', 'going']",2021-07-08 16:44:04,"{'neg': 0.0, 'neu': 1.0, 'pos': 0.0, 'compound': 0.0}",neutral
"I will support Italy because I preferred their game compared to that of the English (plus the English took out Germany, unforgivable). Frankly, I would have loved for Denmark to be in the final but hey, you have to make up your mind!","['English', 'support', 'Italy', 'preferred', 'game']",2021-07-08 11:53:48,"{'neg': 0.0, 'neu': 0.892, 'pos': 0.108, 'compound': 0.5562}",positive
My Latin side still wants to support Italy despite the comedia del arte style on the field and the defeat in 2006. I like the English game but damn their supporters are pulling me out through the nose holes.,"['Latin', 'side', 'still', 'wants', 'support']",2021-07-08 12:07:14,"{'neg': 0.121, 'neu': 0.717, 'pos': 0.162, 'compound': 0.2263}",positive
"Just for Chiellini and his enthusiasm, La Squadra Azurra.
>Hello FL! How are you?

For the few football fans who hang around here and who normally support the Blues, which team are you going to support for the Euro final?

We agree that the best thing would be Bane showing up to destroy the stadium and cancel the match, but otherwise? I have a hard time choosing.

Pro England:

- The Italians are our football rivals.
- We will have the excuse that they played everything at home.
- They would move to one euro, unlike Italy which would move to two and catch up with us.

Pro Italy:

- The English are our rivals in folklore, like Joan of Arc and the war of the English Channel fishermen.
- The English who have earned nothing for 50 years is funny and it should last.
- Italy offered a better game.

Sorry for the football spam for others!

Good day !

Italy just for their national anthem and the enthusiasm of Chiellini.","['Italy', 'football', 'would', 'English', 'Chiellini']",2021-07-08 11:38:25,"{'neg': 0.079, 'neu': 0.742, 'pos': 0.178, 'compound': 0.9596}",positive
"Frankly I'm for the English, they haven't won anything since 1966. I don't know if it's deserved from a sporting point of view though.","['Frankly', 'Im', 'English', 'havent', 'anything']",2021-07-08 11:49:04,"{'neg': 0.125, 'neu': 0.875, 'pos': 0.0, 'compound': -0.4585}",negative
"Yesterday I posted [this](https://www.reddit.com/r/france/comments/ofc3ga/forum_libre_20210707/h4ckmhk/?utm_source=reddit&utm_medium=web2x&context=3) and I realized that there were lots of free slots, so I made an appointment and 1 hour later I got vaccinated.

It's curious because there were many more ""administrative"" steps in the 2nd center, I thought the procedure was unified.","['Yesterday', 'posted', 'thishttpswwwredditcomrfrancecommentsofc3gaforumlibre20210707h4ckmhkutmsourceredditutmmediumweb2xcontext3', 'realized', 'lots']",2021-07-08 11:42:43,"{'neg': 0.0, 'neu': 0.814, 'pos': 0.186, 'compound': 0.802}",positive
"Ah well I wanted to ask if that was normal. I was asked for my information 5 times between the site and the different people at the hospital, I found it a bit exaggerated anyway.

Well at least I had a touch with one of the nurses, she marked “BG” in the observations!","['Ah', 'well', 'wanted', 'ask', 'normal']",2021-07-08 11:49:36,"{'neg': 0.029, 'neu': 0.879, 'pos': 0.092, 'compound': 0.4753}",positive
"I spent around twenty hours cumulatively on Octopath Traveler and... it's not great, actually, is it? Ok the settings are quite pretty with this ""3D pixel-art"" effect (but this is not really the case for the character sprites) and the combat system has some originalities, but everything else... the game world has no depth, the characters are hollow for the most part and few have interesting stories (not to mention that for the moment they do not overlap at any time), the episodes of the latter always follow the same pattern (talking to NPCs , use the character's special ability, do a dungeon, beat a boss, repeat), ... yet the game had rather positive critical feedback, I don't understand.","['game', 'characters', 'spent', 'around', 'twenty']",2021-07-08 13:54:06,"{'neg': 0.072, 'neu': 0.786, 'pos': 0.142, 'compound': 0.8807}",positive
I might start a tsunami but I was also disappointed with this game and even more so I preferred Bravely Default II to this one.,"['might', 'start', 'tsunami', 'also', 'disappointed']",2021-07-08 13:56:30,"{'neg': 0.146, 'neu': 0.669, 'pos': 0.185, 'compound': 0.2762}",positive
"I started it and it’s been hanging around in my library for a few months. It’s very beautiful, let’s say, but it’s quite hollow. Maybe I'll get back into it.","['’', 'started', 'hanging', 'around', 'library']",2021-07-08 16:04:35,"{'neg': 0.0, 'neu': 0.912, 'pos': 0.088, 'compound': 0.3811}",positive
"I really liked Octopath. It's true that it's a bit repetitive, but it's a turn-based Japanese RPG so nothing surprising, ultimately. I agree with you on only one point, because I was very disappointed by the completely strawberry script, with unfortunately flat characters, with almost non-existent issues. Each character is an archetype from which they never emerge, their entire personality is centered around a single character trait, which is a shame. I often skipped the dialogues because they are so osef.

Apart from that, the universe is very nice and the combat mechanics are very enjoyable. Nothing extremely innovative, but some appreciable originalities. It seems that the end-game is really worth it but I admit to having let go once the last chapter of each character was concluded >! because I was also very disappointed to discover that there was no link between each story , and that would no longer be the case afterwards!<. One day, maybe, >!seems like the true last boss is really nice!<!","['really', 'character', 'true', 'disappointed', 'nice']",2021-07-08 14:15:35,"{'neg': 0.185, 'neu': 0.692, 'pos': 0.123, 'compound': -0.922}",negative
"Next week I will be in the wine region where Sébago moccasins and sweaters around the neck are trendy accessories. Does anyone have any stylish wineries to recommend, to visit and drink while gaining knowledge?","['Next', 'week', 'wine', 'region', 'Sébago']",2021-07-08 16:23:08,"{'neg': 0.0, 'neu': 0.858, 'pos': 0.142, 'compound': 0.6486}",positive
"If you call an international number but the person doesn't answer, do the operators charge for the call attempt?","['call', 'international', 'number', 'person', 'doesnt']",2021-07-08 17:19:27,"{'neg': 0.0, 'neu': 0.94, 'pos': 0.06, 'compound': 0.0387}",neutral
"If you stay at the tut tut stage when you hang up, you shouldn't be charged. If you come across an answering machine, however, it's as if we had picked up (the call begins), so you may be billed.","['tut', 'stay', 'stage', 'hang', 'shouldnt']",2021-07-08 17:53:16,"{'neg': 0.0, 'neu': 0.96, 'pos': 0.04, 'compound': 0.1511}",positive
"Hi all !
I'm looking for the title of a movie and sorry in advance if I'm a little vague.

It's a fairly recent film, less than 5 years old I would say, it tells the life of a slightly cracked press photographer, who, among other things, was in Sarajevo during the war.

Thanks in advance.

PS: if you also have an idea of ​​a platform where I can buy it or stream it, that would be super cool.

Edit: I found the title and I'm putting it there, it may be useful to others. It is sympathy for the devil of Guillaume de Fontenay. It is available on vod on Arte.","['Im', 'title', 'advance', 'would', 'Hi']",2021-07-08 17:27:11,"{'neg': 0.09, 'neu': 0.787, 'pos': 0.124, 'compound': 0.623}",positive
"Wouldn’t it be “Very Special Envoys” on Netflix? Never seen it, but the scenario could match.","['’', '“', 'Special', 'Envoys', '”']",2021-07-08 18:13:20,"{'neg': 0.0, 'neu': 0.89, 'pos': 0.11, 'compound': 0.2144}",positive
"Yo!

Are there any Switch players around? I just bought one, with the Ring fit, and I was wondering which games to get without leaving 50 balls in it each time.

I got the subscription for online so I play around with NES/SNES games, but I would like something real to sink my teeth into.

The only promotions I can find at the moment are on Bandai Namco games that aren't crazy...","['games', 'around', 'Yo', 'Switch', 'players']",2021-07-08 18:41:52,"{'neg': 0.0, 'neu': 0.896, 'pos': 0.104, 'compound': 0.7469}",positive
"Hades: €25.
It's not my type of game usually, but I got so attached to this story. 100% no regrets on my part.","['Hades', '€25', 'type', 'game', 'usually']",2021-07-08 18:46:18,"{'neg': 0.232, 'neu': 0.768, 'pos': 0.0, 'compound': -0.7227}",negative
"At around €20 per game you

Little evening games:

Overcooked 1 & 2

Move out

Just Dance previous year,

Heave Ho

worms

&#x200B;

Cheap single player games:

Celestial

Gray

Ori and the bind forest 1 & 2

  


One last piece of advice is to buy them physically, it's cheaper and you can resell them.","['games', '1', '2', 'around', '€20']",2021-07-08 18:57:09,"{'neg': 0.0, 'neu': 1.0, 'pos': 0.0, 'compound': 0.0}",neutral
Leboncoin is always good for buying cheaper.,"['Leboncoin', 'always', 'good', 'buying', 'cheaper']",2021-07-08 19:02:35,"{'neg': 0.0, 'neu': 0.674, 'pos': 0.326, 'compound': 0.4404}",positive
"I advise you to take a look at Hamster Joueur which offers all the good deals on the internet, especially at the moment.","['advise', 'take', 'look', 'Hamster', 'Joueur']",2021-07-08 19:12:30,"{'neg': 0.0, 'neu': 0.873, 'pos': 0.127, 'compound': 0.4404}",positive
"My PC no longer starts. It even tripped the room breaker when I plugged it in.

It seems to be the PSU. I HOPE it's *just* the PSU.

Damn, I'm salty.","['PSU', 'PC', 'longer', 'starts', 'even']",2021-07-08 19:02:41,"{'neg': 0.142, 'neu': 0.753, 'pos': 0.105, 'compound': -0.0688}",negative
Shower thought: What stops one country from printing its neighbor's currency?,"['Shower', 'thought', 'stops', 'one', 'country']",2021-07-08 21:14:20,"{'neg': 0.138, 'neu': 0.862, 'pos': 0.0, 'compound': -0.1531}",negative
"Well we do it well here, we print the currency of the Belgians, Germans, Italians and Spaniards!","['Well', 'well', 'print', 'currency', 'Belgians']",2021-07-08 21:42:43,"{'neg': 0.0, 'neu': 0.77, 'pos': 0.23, 'compound': 0.5411}",positive
"As I like refined things, science, subtlety, I decided to share [this musical gem with you](https://old.reddit.com/r/Unexpected/comments/ofp0it/my_new_ringtone/?ref =share&ref_source=link)","['like', 'refined', 'things', 'science', 'subtlety']",2021-07-08 06:15:11,"{'neg': 0.0, 'neu': 0.734, 'pos': 0.266, 'compound': 0.5719}",positive
Refined is the word,"['Refined', 'word']",2021-07-08 08:09:40,"{'neg': 0.0, 'neu': 1.0, 'pos': 0.0, 'compound': 0.0}",neutral
That's wonderful,"['Thats', 'wonderful']",2021-07-08 11:31:29,"{'neg': 0.0, 'neu': 0.213, 'pos': 0.787, 'compound': 0.5719}",positive
[removed],['removed'],2021-07-08 08:29:32,"{'neg': 0.0, 'neu': 1.0, 'pos': 0.0, 'compound': 0.0}",neutral
"Look at the DIRISI, the transmissions (apart from the RT of the Rens' brigade), the DGNUM and COMCYBER and the intelligence organs (DRM, DGSE DT).

They take on a lot of apprentices in general, especially DIRISI (I have a friend who had his work-study there in Web).

You can also look at the reserve, for example at the 8th RT at Mont Valerian, if you can't get your work-study in the army but you still want to taste it.

For the future, by leaving bac+5 you can apply for CSO management or staff contracts via St-Cyr, Navale or Salon if you want traditional armies, or contractual for mixed fields (pure IT in project manager for the development of an app or applied as a cyber analyst for example)","['DIRISI', 'RT', 'workstudy', 'example', 'want']",2021-07-08 09:16:02,"{'neg': 0.0, 'neu': 0.945, 'pos': 0.055, 'compound': 0.6187}",positive
"If it helps you, the work-study offers in the army are on this link (yes it is marked internships but in ""types of offers"" you can filter by type of contract): https://www. stages.defense.gouv.fr/","['offers', 'helps', 'workstudy', 'army', 'link']",2021-07-08 08:34:02,"{'neg': 0.0, 'neu': 0.947, 'pos': 0.053, 'compound': 0.2023}",positive
"It's definitely possible, I have quite a few friends in it.","['definitely', 'possible', 'quite', 'friends']",2021-07-08 11:23:33,"{'neg': 0.0, 'neu': 0.535, 'pos': 0.465, 'compound': 0.7251}",positive
The easiest way is to make an appointment at the Cirfa nearest to you.,"['easiest', 'way', 'make', 'appointment', 'Cirfa']",2021-07-08 08:32:37,"{'neg': 0.0, 'neu': 0.823, 'pos': 0.177, 'compound': 0.4215}",positive
"Objective for this weekend:

Don't be sober until Monday morning, and the challenge begins now.","['Objective', 'weekend', 'Dont', 'sober', 'Monday']",2021-07-08 17:52:44,"{'neg': 0.0, 'neu': 0.915, 'pos': 0.085, 'compound': 0.0772}",positive
"Health....^(but not feet.)

^(Which way is the exit? There? or over there?)","['Healthbut', 'feet', 'way', 'exit']",2021-07-08 18:44:04,"{'neg': 0.0, 'neu': 1.0, 'pos': 0.0, 'compound': 0.0}",neutral
Cheers!!,['Cheers'],2021-07-09 10:39:26,"{'neg': 0.0, 'neu': 0.0, 'pos': 1.0, 'compound': 0.5696}",positive
"Microsoft Office question: I recently changed companies and the whole company (at least my colleagues) work on Office in English.

Being used to French (even if English *no es un problema* as they say across the Channel), I put Office in French.

Indeed, I work a lot on Excel and with a lot of formulas. However, I know the formulas in French and not in English (even if it can be learned).

Is there a ""translation"" of the formulas if for example an English colleague sends me an excel file with formulas in English and I work on it. Or in this case should I continue with the syntax of the English formulas?

EDIT: In addition to your answer I did a test using a virtual machine (with excel in English) and it's good the formulas are translated

Thank you for your answers","['English', 'formulas', 'Office', 'work', 'French']",2021-07-08 08:07:21,"{'neg': 0.0, 'neu': 0.897, 'pos': 0.103, 'compound': 0.9246}",positive
"I regularly share Excel files using formulas with colleagues from other countries, there has never been a problem.","['regularly', 'share', 'Excel', 'files', 'using']",2021-07-08 08:16:21,"{'neg': 0.0, 'neu': 0.635, 'pos': 0.365, 'compound': 0.7549}",positive
"According to [this site](https://en.excel-translator.de/):

*Normally, when you share a workbook with someone who uses Microsoft Excel in a different language than you, the functions and formulas from your workbook are automatically translated by Excel.*","['workbook', 'Excel', 'According', 'sitehttpsenexceltranslatorde', 'Normally']",2021-07-08 08:14:26,"{'neg': 0.0, 'neu': 0.852, 'pos': 0.148, 'compound': 0.6369}",positive
"In general it works, but it can quickly break down when you have macros.
I advise you to set Excel to have a point as a decimal separator (rather than a comma, as is done by default in the French versions), this will save you a lot of compatibility problems.","['general', 'works', 'quickly', 'break', 'macros']",2021-07-08 08:48:31,"{'neg': 0.066, 'neu': 0.78, 'pos': 0.154, 'compound': 0.6956}",positive
"Problem solved according to the other comments, but for your sanity I strongly recommend that you learn the English formulas once and for all. No need to switch anymore, and a lot more help, especially on the essential xla developers.","['Problem', 'solved', 'according', 'comments', 'sanity']",2021-07-08 11:09:59,"{'neg': 0.097, 'neu': 0.665, 'pos': 0.238, 'compound': 0.7776}",positive
"It's translated. On the other hand, I hope you don't work with CSVs, otherwise you risk messing around with field and decimal separators.","['translated', 'hand', 'hope', 'dont', 'work']",2021-07-08 19:29:19,"{'neg': 0.077, 'neu': 0.699, 'pos': 0.224, 'compound': 0.6124}",positive
"Anyone here who has an Etsy store? I wanted to know how things work logistically, do they have partnerships with carriers or is it up to the sellers to manage all that?","['Anyone', 'Etsy', 'store', 'wanted', 'know']",2021-07-08 08:36:48,"{'neg': 0.0, 'neu': 1.0, 'pos': 0.0, 'compound': 0.0}",neutral
"The seller takes care of everything, Etsy just provides you with a customer front where you can display information.","['seller', 'takes', 'care', 'everything', 'Etsy']",2021-07-08 08:43:15,"{'neg': 0.0, 'neu': 0.842, 'pos': 0.158, 'compound': 0.4939}",positive
"But the hell is it coded with the feet or what is the intermarché drive app?? It's the cross and the banner, this thing. Damn site that encounters a technical problem THE day I need it when I usually never use it.","['hell', 'coded', 'feet', 'intermarché', 'drive']",2021-07-08 08:54:23,"{'neg': 0.278, 'neu': 0.722, 'pos': 0.0, 'compound': -0.9419}",negative
It's Murphy's Law,"['Murphys', 'Law']",2021-07-08 09:34:59,"{'neg': 0.0, 'neu': 1.0, 'pos': 0.0, 'compound': 0.0}",neutral
My sink faucet remained in my hands because it is completely outdated. Do you know if it's up to the owner or the tenant to pay that?,"['sink', 'faucet', 'remained', 'hands', 'completely']",2021-07-08 08:55:47,"{'neg': 0.051, 'neu': 0.949, 'pos': 0.0, 'compound': -0.1027}",negative
unless it is a seal to be changed (this is maintenance of the seals) owner.,"['unless', 'seal', 'changed', 'maintenance', 'seals']",2021-07-08 08:59:27,"{'neg': 0.0, 'neu': 1.0, 'pos': 0.0, 'compound': 0.0}",neutral
"It's for them. Don't be fooled. On the other hand, you do not have the right to withhold the rent.","['Dont', 'fooled', 'hand', 'right', 'withhold']",2021-07-08 12:37:50,"{'neg': 0.0, 'neu': 0.77, 'pos': 0.23, 'compound': 0.658}",positive
"After sanding The Expanse, and rather a fan of space opera in general, I really want to test Star Citizen.


But for that, I have to buy a computer that can run it, and it's not yet a party in this market.


So, I'm frustrated, but still excited.","['sanding', 'Expanse', 'rather', 'fan', 'space']",2021-07-08 09:48:07,"{'neg': 0.152, 'neu': 0.731, 'pos': 0.116, 'compound': -0.5938}",negative
"About The Expanse. I'm the only one who signed up for season 4 (produced by Prime Video unlike the others, if I understood correctly) after loving the first ones?

I found that not much or almost nothing happened during certain episodes and I stopped halfway through, around the halfway point.

Is it getting better with season 5?","['season', 'halfway', 'Expanse', 'Im', 'one']",2021-07-08 12:03:50,"{'neg': 0.062, 'neu': 0.818, 'pos': 0.12, 'compound': 0.6647}",positive
He's not that greedy in reality. A mid-range PC does the trick. I was running it on average with an old i7 and a radeon vega 56,"['Hes', 'greedy', 'reality', 'midrange', 'PC']",2021-07-08 09:57:02,"{'neg': 0.048, 'neu': 0.874, 'pos': 0.078, 'compound': 0.193}",positive
An account loan can be negotiated. I haven't touched it in a while ;),"['account', 'loan', 'negotiated', 'havent', 'touched']",2021-07-08 10:23:48,"{'neg': 0.0, 'neu': 0.853, 'pos': 0.147, 'compound': 0.2263}",positive
"If you're not in a hurry, there should be new free flight periods at the end of summer.","['youre', 'hurry', 'new', 'free', 'flight']",2021-07-08 09:50:34,"{'neg': 0.0, 'neu': 0.829, 'pos': 0.171, 'compound': 0.5106}",positive
"Honestly, I hope you want to play other things because that's a lot of money to quickly go around in circles in space...","['Honestly', 'hope', 'want', 'play', 'things']",2021-07-08 12:35:42,"{'neg': 0.0, 'neu': 0.639, 'pos': 0.361, 'compound': 0.8225}",positive
"It's Thursday, it's drop day (maybe?) on https://amd.com for graphics cards.","['Thursday', 'drop', 'day', 'maybe', 'httpsamdcom']",2021-07-08 13:53:19,"{'neg': 0.174, 'neu': 0.826, 'pos': 0.0, 'compound': -0.2732}",negative
"For what ?

story is feminine and we say: “My story” and not “My story”?

Eh ? For what ?

Do you have any other examples?","['story', '“', '”', 'feminine', 'say']",2021-07-08 18:43:07,"{'neg': 0.0, 'neu': 1.0, 'pos': 0.0, 'compound': 0.0}",neutral
"Because euphony damn it, euphony.

Ma + feminine word that begins with a vowel = my. Because otherwise it looks ugly and choppy in the verbal flow.","['euphony', 'damn', 'feminine', 'word', 'begins']",2021-07-08 19:23:49,"{'neg': 0.214, 'neu': 0.786, 'pos': 0.0, 'compound': -0.7184}",negative
Wouldn't it be something like this if the word starts with a vowel we say my? (Or something like that),"['something', 'like', 'Wouldnt', 'word', 'starts']",2021-07-08 18:50:58,"{'neg': 0.0, 'neu': 0.773, 'pos': 0.227, 'compound': 0.6124}",positive
"Because we make the connection.

They say my car, my hallucination...","['make', 'connection', 'say', 'car', 'hallucination']",2021-07-08 18:51:46,"{'neg': 0.0, 'neu': 1.0, 'pos': 0.0, 'compound': 0.0}",neutral
"Anchor, ink, cabinet, star, shelf, test tube, landing net, purse, study, association, action,...","['Anchor', 'ink', 'cabinet', 'star', 'shelf']",2021-07-08 19:10:09,"{'neg': 0.0, 'neu': 1.0, 'pos': 0.0, 'compound': 0.0}",neutral
"Go as usual, Vaccinated! At occupational health even though I'm not working. Thank you my neighborhood pharmacy which supplies them with both vaccines and patients.","['Go', 'usual', 'Vaccinated', 'occupational', 'health']",2021-07-08 09:36:16,"{'neg': 0.091, 'neu': 0.909, 'pos': 0.0, 'compound': -0.3404}",negative
"me too 1st dose
let's pray together","['1st', 'dose', 'lets', 'pray', 'together']",2021-07-08 09:50:38,"{'neg': 0.0, 'neu': 0.723, 'pos': 0.277, 'compound': 0.3182}",positive
"I've been in the United States for a little over 3 years and my company has finally launched the green card procedure.

In a year and a half/2 years, I will finally have a choice! Note that they added a fee repayment clause because lately people leave immediately after getting it...","['years', 'finally', 'Ive', 'United', 'States']",2021-07-08 05:25:38,"{'neg': 0.026, 'neu': 0.876, 'pos': 0.098, 'compound': 0.5255}",positive
"> cost repayment clause

Boarf, if you know how to negotiate, your future employer will be able to pay you them too.","['cost', 'repayment', 'clause', 'Boarf', 'know']",2021-07-08 07:20:31,"{'neg': 0.065, 'neu': 0.935, 'pos': 0.0, 'compound': -0.1027}",negative
Day two without meta,"['Day', 'two', 'without', 'meta']",2021-07-08 08:36:04,"{'neg': 0.0, 'neu': 1.0, 'pos': 0.0, 'compound': 0.0}",neutral
"I had a minor car accident and need to make repairs. I don't know anything about it, I was advised to get parts from the scrapyard. If you have any advice or redirect me to specialized forums, I'm interested.
http://imgur.com/a/xfQzHWG","['minor', 'car', 'accident', 'need', 'make']",2021-07-08 19:12:35,"{'neg': 0.078, 'neu': 0.854, 'pos': 0.068, 'compound': -0.1027}",negative
[removed],['removed'],2021-07-08 11:48:51,"{'neg': 0.0, 'neu': 1.0, 'pos': 0.0, 'compound': 0.0}",neutral
