Frase,Parole chiave,Data,Sentiment,Sentiment risultato
,"['Euthanasia', 'want', 'die', 'dignity', 'Belgium']",2021-05-19 18:37:09,"{'neg': 0.0, 'neu': 0.0, 'pos': 0.0, 'compound': 0.0}",neutral
We treat our animals at the end of their lives better than our elderly in France.,"['treat', 'animals', 'end', 'lives', 'better']",2021-05-19 22:12:44,"{'neg': 0.0, 'neu': 0.714, 'pos': 0.286, 'compound': 0.6808}",positive
It takes courage to accept as these patients and their families do.,"['takes', 'courage', 'accept', 'patients', 'families']",2021-05-19 19:03:18,"{'neg': 0.0, 'neu': 0.633, 'pos': 0.367, 'compound': 0.7003}",positive
"I quite agree with the idea that admitting euthanasia is admitting a failure of the health system and taking an ""easy"" solution rather than improving this system and in particular the psychological care of the person. want to die. Accepting euthanasia also means risking shortening lives that could still have felt and given happiness to those around them.

Suicide is a strategy to stop suffering, but today there are other gentle strategies. Perhaps these people would suffer less from their infirmity if we lived in a less normative world, less demanding and more welcoming towards weakness.

Now, if as a group, we are more capable of making these efforts, perhaps indeed, it is better while waiting for more favorable times.","['less', 'admitting', 'euthanasia', 'system', 'quite']",2021-05-20 09:15:01,"{'neg': 0.155, 'neu': 0.624, 'pos': 0.221, 'compound': 0.8692}",positive
"> Accepting euthanasia also means risking shortening lives that could still have felt and given happiness to those around them.

I think we must not forget the pleasure/pain balance. I don't think I want to continue living for 5 minutes of pleasure a day and the rest in pain, knowing that it will get worse with time. There is a threshold that must be delimited by the person themselves, and not a law or another person, that makes no sense.","['think', 'must', 'person', 'Accepting', 'euthanasia']",2021-05-20 10:39:25,"{'neg': 0.14, 'neu': 0.727, 'pos': 0.133, 'compound': 0.1139}",positive
"I think that from the moment the patient himself asks to die but is not capable of doing it himself we should offer him a way out. At the time I was very marked by the [Vincent Humbert] affair (https://fr.m.wikipedia.org/wiki/Affaire_Vincent_Humbert) which had greatly launched the debate on euthanasia. For cases like his refusing the ""right to die"" as he calls it seems really strange to me.
For unconscious patients obviously the question is more delicate. I'm not saying that euthanasia should be the default option. But it should be an option. A supervised and supervised option, but an option nonetheless.","['option', 'die', 'euthanasia', 'supervised', 'think']",2021-05-20 11:15:33,"{'neg': 0.15, 'neu': 0.786, 'pos': 0.064, 'compound': -0.8907}",negative
There is no such thing as a dignified death,"['thing', 'dignified', 'death']",2021-05-20 03:28:56,"{'neg': 0.427, 'neu': 0.35, 'pos': 0.224, 'compound': -0.4404}",negative
Ok Gregory House.,"['Ok', 'Gregory', 'House']",2021-05-20 06:21:22,"{'neg': 0.0, 'neu': 0.476, 'pos': 0.524, 'compound': 0.296}",positive
Why wouldn't it exist?,"['wouldnt', 'exist']",2021-05-20 09:25:58,"{'neg': 0.0, 'neu': 1.0, 'pos': 0.0, 'compound': 0.0}",neutral
"Bernard Kouchner wants to ban the word ""euthanasia"" because it has ""Nazi"" in it, ""which is not nice""","['Bernard', 'Kouchner', 'wants', 'ban', 'word']",2014-06-26 10:55:56,"{'neg': 0.27, 'neu': 0.73, 'pos': 0.0, 'compound': -0.7124}",negative
,"['Bernard', 'Kouchner', 'wants', 'ban', 'word']",2014-06-26 10:55:56,"{'neg': 0.0, 'neu': 0.0, 'pos': 0.0, 'compound': 0.0}",neutral
Soral has a heart attack upon realizing the hidden meaning of conspira**Zionist**,"['Soral', 'heart', 'attack', 'upon', 'realizing']",2014-06-26 11:56:22,"{'neg': 0.237, 'neu': 0.763, 'pos': 0.0, 'compound': -0.4767}",negative
Not to mention the contortionists!,"['mention', 'contortionists']",2014-06-26 14:37:10,"{'neg': 0.0, 'neu': 1.0, 'pos': 0.0, 'compound': 0.0}",neutral
"The word Kouchner will soon be banned too, because there's ""layer"" in it, and it reminds us of DSK.","['word', 'Kouchner', 'soon', 'banned', 'theres']",2014-06-26 11:39:19,"{'neg': 0.143, 'neu': 0.857, 'pos': 0.0, 'compound': -0.4588}",negative
"The words nasal, vinegar, deputy, nycthemera, peduncle, etc. should be banned.","['words', 'nasal', 'vinegar', 'deputy', 'nycthemera']",2014-06-26 11:52:12,"{'neg': 0.231, 'neu': 0.769, 'pos': 0.0, 'compound': -0.4588}",negative
"And metro or RER stations too, like “Bourg-la-Reine”, which is not kind to the queen.","['metro', 'RER', 'stations', 'like', '“']",2014-06-26 12:23:27,"{'neg': 0.152, 'neu': 0.711, 'pos': 0.137, 'compound': -0.0711}",negative
Without forgetting beam.,"['Without', 'forgetting', 'beam']",2014-06-26 12:22:10,"{'neg': 0.0, 'neu': 1.0, 'pos': 0.0, 'compound': 0.0}",neutral
Concupiscent would be to be banned three times.,"['Concupiscent', 'would', 'banned', 'three', 'times']",2014-06-26 14:31:16,"{'neg': 0.3, 'neu': 0.7, 'pos': 0.0, 'compound': -0.4588}",negative
We will soon no longer be able to ROUXflow,"['soon', 'longer', 'able', 'ROUXflow']",2014-06-26 12:45:36,"{'neg': 0.216, 'neu': 0.784, 'pos': 0.0, 'compound': -0.296}",negative
"It is very regrettable that this great man is not part of the Cadémie Rançaise, his talent would be very appreciated there.","['regrettable', 'great', 'man', 'part', 'Cadémie']",2014-06-26 11:46:37,"{'neg': 0.112, 'neu': 0.561, 'pos': 0.327, 'compound': 0.7845}",positive
"> the Cadémie Rançaise

In good *French*, we do not capitalize an adjective.","['Cadémie', 'Rançaise', 'good', 'French', 'capitalize']",2014-06-26 16:43:28,"{'neg': 0.0, 'neu': 0.791, 'pos': 0.209, 'compound': 0.4404}",positive
"Or not, actually.",['actually'],2014-06-26 11:48:48,"{'neg': 0.0, 'neu': 1.0, 'pos': 0.0, 'compound': 0.0}",neutral
"Reading a title like that, we honestly tend to think that it's Gorafi's bullshit, but unfortunately, no.","['Reading', 'title', 'like', 'honestly', 'tend']",2014-06-26 12:10:41,"{'neg': 0.36, 'neu': 0.477, 'pos': 0.163, 'compound': -0.6757}",negative
What Kouchner said doesn't have much to do with the title either.,"['Kouchner', 'said', 'doesnt', 'much', 'title']",2014-06-26 15:48:42,"{'neg': 0.0, 'neu': 1.0, 'pos': 0.0, 'compound': 0.0}",neutral
"Obviously, it's always the Nazis who have the bad role. It's 2014, can we have a second chance?! THANKS !","['Obviously', 'always', 'Nazis', 'bad', 'role']",2014-06-26 14:35:33,"{'neg': 0.148, 'neu': 0.675, 'pos': 0.178, 'compound': 0.182}",positive
I like it when someone coats me with oil,"['like', 'someone', 'coats', 'oil']",2014-06-26 18:19:00,"{'neg': 0.0, 'neu': 0.737, 'pos': 0.263, 'compound': 0.3612}",positive
The downvotes you receive make me sad.,"['downvotes', 'receive', 'make', 'sad']",2014-06-26 15:39:40,"{'neg': 0.341, 'neu': 0.659, 'pos': 0.0, 'compound': -0.4767}",negative
"/r/paslegorafi?


Otherwise we would also have to ban Asia in general, right?","['rpaslegorafi', 'Otherwise', 'would', 'also', 'ban']",2014-06-26 12:10:17,"{'neg': 0.265, 'neu': 0.735, 'pos': 0.0, 'compound': -0.6072}",negative
Just people who live in Nasie.,"['people', 'live', 'Nasie']",2014-06-26 12:46:55,"{'neg': 0.0, 'neu': 1.0, 'pos': 0.0, 'compound': 0.0}",neutral
"Nerve layer... it definitely bears its name poorly.

If we banned bullshit, on the other hand, the ministries would collect a little dust.","['Nerve', 'layer', 'definitely', 'bears', 'name']",2014-06-26 18:21:16,"{'neg': 0.221, 'neu': 0.586, 'pos': 0.192, 'compound': -0.2263}",negative
"Damn, the drug is strong!","['Damn', 'drug', 'strong']",2014-06-26 19:21:04,"{'neg': 0.291, 'neu': 0.323, 'pos': 0.387, 'compound': 0.2244}",positive
"Wait but what he says makes sense, already he's not talking about ""banning"" the word but simply stopping using it and then it's just because it gives a pejorative side to the meaning. It doesn't seem completely absurd to me as a reasoning, when I think of euthanasia I think directly of Nazi and given the practice it is perhaps not the best of words.
Well anyway, a word can't be replaced just like that but hey I just think it's not completely stupid either...","['think', 'word', 'completely', 'Wait', 'says']",2014-06-26 12:11:56,"{'neg': 0.071, 'neu': 0.819, 'pos': 0.109, 'compound': 0.5326}",positive
"Typically politicking as a way of thinking.

Blind? Nah, too strong => Blind.
Deaf? Same => Non-hearing.
Old person? Pejorative => Senior.","['Blind', 'Typically', 'politicking', 'way', 'thinking']",2014-06-26 12:25:08,"{'neg': 0.266, 'neu': 0.615, 'pos': 0.119, 'compound': -0.466}",negative
"Let's continue to level the culture down, people are not stupid enough today, we agree. Between that and the term S students who complain because they find their maths baccalaureate subject too hard.
FYI, euthanasia in Greek means “sweet death”. To see Nazism there is to make really dubious jokes.","['Lets', 'continue', 'level', 'culture', 'people']",2014-06-26 15:19:52,"{'neg': 0.114, 'neu': 0.715, 'pos': 0.172, 'compound': 0.5258}",positive
We will stick to apostasy.,"['stick', 'apostasy']",2014-06-26 12:46:23,"{'neg': 0.0, 'neu': 1.0, 'pos': 0.0, 'compound': 0.0}",neutral
[removed],['removed'],2014-06-26 12:40:15,"{'neg': 0.0, 'neu': 1.0, 'pos': 0.0, 'compound': 0.0}",neutral
You're the one who risks getting banned with comments like this.,"['Youre', 'one', 'risks', 'getting', 'banned']",2014-06-26 16:46:49,"{'neg': 0.327, 'neu': 0.513, 'pos': 0.16, 'compound': -0.3818}",negative
Their thing turns into an obsession.,"['thing', 'turns', 'obsession']",2014-06-26 11:49:22,"{'neg': 0.324, 'neu': 0.676, 'pos': 0.0, 'compound': -0.34}",negative
"I see that you are in denial, you can be prosecuted for that and you know it.","['see', 'denial', 'prosecuted', 'know']",2014-06-26 14:32:54,"{'neg': 0.148, 'neu': 0.852, 'pos': 0.0, 'compound': -0.3818}",negative
"Bravo Nanard, we will go far!","['Bravo', 'Nanard', 'go', 'far']",2014-06-26 11:26:15,"{'neg': 0.0, 'neu': 1.0, 'pos': 0.0, 'compound': 0.0}",neutral
"I think that when Kouchner says ""there is the word Nazi in euthanasia"", it is a *light* way of reminding us that euthanasia has long been associated with the Nazis, who euthanized thousands of mentally ill people in their death program. racial hygiene. Obviously this still weighs on the debate today (a society which euthanizes its patients, does it not risk drifting).

Or he has a shitty sense of humor.","['euthanasia', 'think', 'Kouchner', 'says', 'word']",2014-06-26 23:11:28,"{'neg': 0.135, 'neu': 0.813, 'pos': 0.051, 'compound': -0.8119}",negative
When I was little I was convinced that “euthanasia” was spelled “Nazi state”. Plus we were talking about killing people so there was a connection :p,"['“', '”', 'little', 'convinced', 'euthanasia']",2014-06-27 06:37:22,"{'neg': 0.151, 'neu': 0.684, 'pos': 0.165, 'compound': -0.1477}",negative
"And in sickness, there is pain.
That's not nice !","['sickness', 'pain', 'Thats', 'nice']",2014-06-27 08:53:29,"{'neg': 0.458, 'neu': 0.542, 'pos': 0.0, 'compound': -0.7117}",negative
"Yeah, as usual we isolate one quote (which is probably a clumsy joke) and ignore the rest. What he says is completely true, and very wise: we must stop preventing people from dying with dignity if it is their choice, just because it straightens the bullets of a few religious people who meddle in affairs. others.","['people', 'Yeah', 'usual', 'isolate', 'one']",2014-06-26 12:42:41,"{'neg': 0.117, 'neu': 0.708, 'pos': 0.175, 'compound': 0.699}",positive
"I consider that inviting the Third Reich into the debate on euthanasia is not ""very wise"". If we want an informed debate we must avoid polarizing the situation and he has just done the opposite. The guy at one point defends but he doesn't do it very well.","['debate', 'consider', 'inviting', 'Third', 'Reich']",2014-06-26 17:49:43,"{'neg': 0.032, 'neu': 0.852, 'pos': 0.117, 'compound': 0.5089}",positive
"The debate on euthanasia deserves a little seriousness.

In any case the man is a politician, when he speaks in public he needs to master his language a little better. Either he makes a good joke or he shuts up. Coming out with this kind of stupidity at your age is taking people for idiots.","['little', 'debate', 'euthanasia', 'deserves', 'seriousness']",2014-06-26 13:11:22,"{'neg': 0.055, 'neu': 0.793, 'pos': 0.152, 'compound': 0.5584}",positive
It's sad that a man like him spouts such nonsense...,"['sad', 'man', 'like', 'spouts', 'nonsense']",2014-06-26 11:32:46,"{'neg': 0.246, 'neu': 0.556, 'pos': 0.198, 'compound': -0.1531}",negative
"A man like him?!

A megalomaniac narcissist who threatened to go on strike if the UN didn't pay him during the Kosovo crisis?!

The guy who wrote the report on Total in Burma?

And let's not talk about his knowledge, or not, of organ trafficking in Kosovo, still...

He's in his line, in fact...","['Kosovo', 'man', 'like', 'megalomaniac', 'narcissist']",2014-06-26 19:29:43,"{'neg': 0.098, 'neu': 0.836, 'pos': 0.066, 'compound': -0.4268}",negative
don't imp,"['dont', 'imp']",2014-06-26 11:33:53,"{'neg': 0.0, 'neu': 1.0, 'pos': 0.0, 'compound': 0.0}",neutral
Referendum in New Zealand: more than 65% of the country says “yes” to euthanasia,"['Referendum', 'New', 'Zealand', '65', 'country']",2020-11-08 08:07:07,"{'neg': 0.0, 'neu': 1.0, 'pos': 0.0, 'compound': 0.0}",neutral
,"['Referendum', 'New', 'Zealand', '65', 'country']",2020-11-08 08:07:07,"{'neg': 0.0, 'neu': 0.0, 'pos': 0.0, 'compound': 0.0}",neutral
"Meanwhile, Gaul resists","['Meanwhile', 'Gaul', 'resists']",2020-11-08 08:19:49,"{'neg': 0.0, 'neu': 1.0, 'pos': 0.0, 'compound': 0.0}",neutral
Can't wait for the same thing in France!,"['Cant', 'wait', 'thing', 'France']",2020-11-08 08:09:49,"{'neg': 0.0, 'neu': 1.0, 'pos': 0.0, 'compound': 0.0}",neutral
"Given the title it almost seems like 65% said “yes” to being euthanized right away, that made me laugh haha","['Given', 'title', 'almost', 'seems', 'like']",2020-11-08 13:51:51,"{'neg': 0.0, 'neu': 0.658, 'pos': 0.342, 'compound': 0.8326}",positive
But they said no to legalizing cannabis :(,"['said', 'legalizing', 'cannabis']",2020-11-08 10:03:47,"{'neg': 0.526, 'neu': 0.474, 'pos': 0.0, 'compound': -0.7684}",negative
"Yes, I'm disgusted.. But it was pretty close.. I voted yes for both, maybe in 10 years we'll have another chance!","['Yes', 'Im', 'disgusted', 'pretty', 'close']",2020-11-08 13:46:39,"{'neg': 0.0, 'neu': 0.562, 'pos': 0.438, 'compound': 0.9098}",positive
"I'm totally for it! As long as it is in good conditions.

I am also for assisted suicide but only in structures belonging to the State to properly regulate all that.","['Im', 'totally', 'long', 'good', 'conditions']",2020-11-08 09:20:25,"{'neg': 0.092, 'neu': 0.849, 'pos': 0.059, 'compound': -0.2714}",negative
Tkt it will end up like the EHPADs which are already on the stock market.,"['Tkt', 'end', 'like', 'EHPADs', 'already']",2020-11-08 10:16:30,"{'neg': 0.0, 'neu': 0.848, 'pos': 0.152, 'compound': 0.3612}",positive
I can't wait for this to spread.,"['cant', 'wait', 'spread']",2020-11-08 09:07:17,"{'neg': 0.0, 'neu': 1.0, 'pos': 0.0, 'compound': 0.0}",neutral
Should a referendum also be held to choose who will be euthanized?,"['referendum', 'also', 'held', 'choose', 'euthanized']",2020-11-08 16:43:06,"{'neg': 0.0, 'neu': 1.0, 'pos': 0.0, 'compound': 0.0}",neutral
The alleged euthanasia of a Dutch teenager panics the world press,"['alleged', 'euthanasia', 'Dutch', 'teenager', 'panics']",2019-06-05 19:01:13,"{'neg': 0.244, 'neu': 0.756, 'pos': 0.0, 'compound': -0.4404}",negative
,"['alleged', 'euthanasia', 'Dutch', 'teenager', 'panics']",2019-06-05 19:01:13,"{'neg': 0.0, 'neu': 0.0, 'pos': 0.0, 'compound': 0.0}",neutral
"In relation to the other post: https://www.reddit.com/r/france/comments/bx1dsu/je_respire_mais_je_ne_vis_plus_%C3%A0_17_ans_elle_se/

That said, euthanasia or refusal to drink changes nothing at the heart of the matter. What happened to this poor girl is an infamous tragedy...","['relation', 'post', 'httpswwwredditcomrfrancecommentsbx1dsujerespiremaisjenevisplusC3A017ansellese', 'said', 'euthanasia']",2019-06-05 19:06:23,"{'neg': 0.104, 'neu': 0.864, 'pos': 0.032, 'compound': -0.5461}",negative
Even a dignified death will have been denied to him.,"['Even', 'dignified', 'death', 'denied']",2019-06-05 23:58:08,"{'neg': 0.425, 'neu': 0.375, 'pos': 0.2, 'compound': -0.5574}",negative
"Her body, her choice, her rights. It’s a shame that out of dogmatism he was refused to die with dignity.","['body', 'choice', 'rights', '’', 'shame']",2019-06-06 00:00:43,"{'neg': 0.342, 'neu': 0.558, 'pos': 0.1, 'compound': -0.7579}",negative
"So if my neighbor wants to commit suicide, I let him do it?","['neighbor', 'wants', 'commit', 'suicide', 'let']",2019-06-06 11:42:55,"{'neg': 0.269, 'neu': 0.599, 'pos': 0.132, 'compound': -0.5106}",negative
It makes me think of the [parents who requested authorization to end the life of their brain-dead daughter Caitlin](https://youtu.be/MGXSPf9b-xI).,"['makes', 'think', 'parents', 'requested', 'authorization']",2019-06-05 19:53:23,"{'neg': 0.0, 'neu': 1.0, 'pos': 0.0, 'compound': 0.0}",neutral
What type of parent allows their children to commit suicide! ?,"['type', 'parent', 'allows', 'children', 'commit']",2019-06-05 20:36:27,"{'neg': 0.32, 'neu': 0.534, 'pos': 0.147, 'compound': -0.5562}",negative
"An understanding parent. But they're not very accepting there, I have the impression.","['understanding', 'parent', 'theyre', 'accepting', 'impression']",2019-06-05 21:10:08,"{'neg': 0.201, 'neu': 0.647, 'pos': 0.152, 'compound': -0.1904}",negative
"It's a person, not a property.","['person', 'property']",2019-06-06 07:10:51,"{'neg': 0.0, 'neu': 1.0, 'pos': 0.0, 'compound': 0.0}",neutral
Françoise Hardy: “I have been a supporter of euthanasia since I was a teenager”,"['Françoise', 'Hardy', '“', 'supporter', 'euthanasia']",2021-05-12 22:51:42,"{'neg': 0.0, 'neu': 0.652, 'pos': 0.348, 'compound': 0.5859}",positive
,"['Françoise', 'Hardy', '“', 'supporter', 'euthanasia']",2021-05-12 22:51:42,"{'neg': 0.0, 'neu': 0.0, 'pos': 0.0, 'compound': 0.0}",neutral
Castex hesitated between Sheila and Françoise Hardy to promote AstraZeneca ;),"['Castex', 'hesitated', 'Sheila', 'Françoise', 'Hardy']",2021-05-13 07:54:06,"{'neg': 0.139, 'neu': 0.424, 'pos': 0.436, 'compound': 0.5994}",positive
"Me too, but it was explained to me that when the person didn't agree, it was more like euthanasia. It greatly reduced my interest in the thing.","['explained', 'person', 'didnt', 'agree', 'like']",2021-05-13 14:39:36,"{'neg': 0.077, 'neu': 0.691, 'pos': 0.233, 'compound': 0.7521}",positive
I wouldn't say no if someone has the entire article :),"['wouldnt', 'say', 'someone', 'entire', 'article']",2021-05-12 22:52:02,"{'neg': 0.0, 'neu': 0.621, 'pos': 0.379, 'compound': 0.5978}",positive
"I have the impression that there are more and more people who are anti-abortion and euthanasia, and that they are completely lost in their heads.","['impression', 'people', 'antiabortion', 'euthanasia', 'completely']",2016-12-03 14:03:47,"{'neg': 0.098, 'neu': 0.83, 'pos': 0.072, 'compound': -0.1761}",negative
"These pro-life ideas existed.

PS: Now I feel a little obliged to respond to people who ignore humor to see a political message. You're breaking my spirits, I just wanted to start an original pun thread (because yes, this joke came from me and I'm proud of it now given the feedback).

 So here it is: you perhaps don't know any women with multiple abortions (even if strangely everyone has heard of ""those women""), but I do. In this case, my mother. The first time she was raped. The second time, she was homeless and alone. The third time, by pure choice (the desire for freedom)

However, the first and second time, it was illegal and very frowned upon. So she went to a forest and they stuck knitting needles in her pussy until it worked.

All that to say, people will do what they have to do, whether it's legal or not. Either we follow morality and consider that they are whores, or we can offer acceptable medical and health conditions, without judgment from others because we don't know their history.

A friend made the connection with shooting rooms. Either you let the junkies die in their shit, or they have access to clean needles and at least they won't get AIDS.","['impression', 'people', 'antiabortion', 'euthanasia', 'completely']",2016-12-03 14:03:47,"{'neg': 0.143, 'neu': 0.756, 'pos': 0.101, 'compound': -0.9473}",negative
"There's no more, we just talk about it more, like in the USA, this subject allows people to be divided.","['Theres', 'talk', 'like', 'USA', 'subject']",2016-12-03 15:30:46,"{'neg': 0.096, 'neu': 0.783, 'pos': 0.121, 'compound': 0.1513}",positive
"I don't think there are any more, on the other hand I think that the people who defend these ideas are more demanding than before.","['think', 'dont', 'hand', 'people', 'defend']",2016-12-03 14:38:14,"{'neg': 0.083, 'neu': 0.796, 'pos': 0.121, 'compound': 0.2516}",positive
I just think OP wanted to share his good joke with us.,"['think', 'OP', 'wanted', 'share', 'good']",2016-12-03 15:10:30,"{'neg': 0.0, 'neu': 0.523, 'pos': 0.477, 'compound': 0.743}",positive
"“Pro-life”, is that really said in France?","['“', 'Prolife', '”', 'really', 'said']",2016-12-03 21:23:42,"{'neg': 0.0, 'neu': 1.0, 'pos': 0.0, 'compound': 0.0}",neutral
That's my question too...but it's okay if everyone here can understand it.,"['Thats', 'question', 'toobut', 'okay', 'everyone']",2016-12-04 04:54:03,"{'neg': 0.0, 'neu': 0.853, 'pos': 0.147, 'compound': 0.2263}",positive
No. It's just the underwear party and they are no longer ashamed to say it when their retrograde ideas are repeated on TV and in the chamber. Are not more numerous. Just louder.,"['underwear', 'party', 'longer', 'ashamed', 'say']",2016-12-03 16:37:16,"{'neg': 0.191, 'neu': 0.74, 'pos': 0.069, 'compound': -0.5859}",negative
"Um, I'm for both, but putting them in the same basket is still a bit weird.","['Um', 'Im', 'putting', 'basket', 'still']",2016-12-03 15:41:36,"{'neg': 0.128, 'neu': 0.872, 'pos': 0.0, 'compound': -0.2617}",negative
you didn't see the tag of the post,"['didnt', 'see', 'tag', 'post']",2016-12-03 15:50:39,"{'neg': 0.0, 'neu': 1.0, 'pos': 0.0, 'compound': 0.0}",neutral
I'm for both even though I hate both.,"['Im', 'even', 'though', 'hate']",2016-12-03 18:51:32,"{'neg': 0.381, 'neu': 0.619, 'pos': 0.0, 'compound': -0.5719}",negative
Downside of the gay marriage law?,"['Downside', 'gay', 'marriage', 'law']",2016-12-03 16:41:38,"{'neg': 0.286, 'neu': 0.714, 'pos': 0.0, 'compound': -0.25}",negative
[removed],['removed'],2016-12-04 03:39:13,"{'neg': 0.0, 'neu': 1.0, 'pos': 0.0, 'compound': 0.0}",neutral
This comment has been deleted. You can express yourself without insulting others.,"['comment', 'deleted', 'express', 'without', 'insulting']",2016-12-04 15:05:34,"{'neg': 0.0, 'neu': 0.807, 'pos': 0.193, 'compound': 0.3875}",positive
"I am anti-abortion from an accounting standpoint only. As long as the rest of the world has 2 to 3 times more children than my tribe, my land, my nation, I feel threatened.","['antiabortion', 'accounting', 'standpoint', 'long', 'rest']",2016-12-03 23:19:57,"{'neg': 0.097, 'neu': 0.903, 'pos': 0.0, 'compound': -0.4588}",negative
Where is the pun?,['pun'],2016-12-04 02:11:05,"{'neg': 0.0, 'neu': 1.0, 'pos': 0.0, 'compound': 0.0}",neutral
Yeah because the murder of tens of thousands of unborn children is a joke. As long as it is done early in the pregnancy at least. 3rd trimester abortion is just murder.,"['murder', 'Yeah', 'tens', 'thousands', 'unborn']",2016-12-03 18:19:00,"{'neg': 0.23, 'neu': 0.662, 'pos': 0.108, 'compound': -0.7906}",negative
"Abortion in the third trimester is illegal in France unless it is carried out for medical reasons (fetus not viable or danger to the mother). And then, if we pushed the argument of bodily autonomy (the mother's right to self-determination) to the limit and we considered that she has the right to ask what we releases the fetus from her body, it is not an abortion which would be carried out at the 7/8/9th month (when the fetus is viable outside the mother's body), but just a premature birth: a cesarean section or a birth vaginal without the need to kill the fetus in the process.","['fetus', 'carried', 'viable', 'mothers', 'right']",2016-12-03 23:35:15,"{'neg': 0.095, 'neu': 0.888, 'pos': 0.017, 'compound': -0.8661}",negative
"The SPA warns of the saturation of shelters, thousands of animals risk euthanasia - a contactless adoption procedure has been developed.","['SPA', 'warns', 'saturation', 'shelters', 'thousands']",2020-04-06 12:26:04,"{'neg': 0.171, 'neu': 0.829, 'pos': 0.0, 'compound': -0.3612}",negative
,"['SPA', 'warns', 'saturation', 'shelters', 'thousands']",2020-04-06 12:26:04,"{'neg': 0.0, 'neu': 0.0, 'pos': 0.0, 'compound': 0.0}",neutral
"Euthanasia is even more of a risk, they will have to go through it.","['Euthanasia', 'even', 'risk', 'go']",2020-04-06 12:52:55,"{'neg': 0.165, 'neu': 0.835, 'pos': 0.0, 'compound': -0.3353}",negative
"It depends on the shelters afterwards. In my town, everything is managed by the associations (without any subsidy even though they are the ones who officially collect the animals), there is no euthanasia. Everything depends on the reception capacity of families. With the confinement, I imagine that many animals remain stray..","['depends', 'animals', 'shelters', 'afterwards', 'town']",2020-04-06 18:38:12,"{'neg': 0.043, 'neu': 0.957, 'pos': 0.0, 'compound': -0.296}",negative
