Frase,Parole chiave,Data,Sentiment,Sentiment risultato
"I'll probably get downvoted to death, but I wouldn't find it completely absurd to have an age limit for voting. Those under 18 do not vote, for legitimate reasons; we could also conceive of legitimate reasons for the right to vote to stop, for example, at age 70. Obviously, that will never happen, since the gerontocracy is not only those who vote, it is also a good part of the elected officials themselves.","['vote', 'age', 'legitimate', 'reasons', 'also']",2016-11-29 11:48:48,"{'neg': 0.068, 'neu': 0.882, 'pos': 0.05, 'compound': -0.1027}",negative
"If you don't vote my way, then you don't deserve to vote.

That's more or less what you think, great lesson in democracy.
We can continue and reason through the absurd, we can also prohibit liberal professions or owners who are more likely to vote on the right from voting.

Edit: spelling and grammar errors","['vote', 'dont', 'way', 'deserve', 'Thats']",2016-11-29 15:55:43,"{'neg': 0.04, 'neu': 0.891, 'pos': 0.069, 'compound': 0.4019}",positive
"The argument behind your proposal for a limit of 70 years is only because they are going to benefit from (/undergo) political changes for a shorter time anyway?

Because at this point you can also refuse the vote to cancer patients, make the vote of smokers count for 10% less as they have 10% less life expectancy... We can go far like that.","['vote', '10', 'less', 'argument', 'behind']",2016-11-29 18:46:48,"{'neg': 0.129, 'neu': 0.793, 'pos': 0.078, 'compound': -0.5574}",negative
"I would rather say that we should raise the voting age (16 years?), because honestly, we are rarely completely gaga at 70, we can still have a vision of the future, particularly for our children or grandchildren.","['would', 'rather', 'say', 'raise', 'voting']",2016-11-29 13:39:18,"{'neg': 0.0, 'neu': 0.868, 'pos': 0.132, 'compound': 0.6124}",positive
"> Retirees have a disproportionate influence on the definition of the political offer.
>
> A major factor weighs on the definition of the political offer for the next presidential election: the vote of retirees. Its ideological and political implications affect both the right and the left. Its relative share continues to grow under the dual effect of demographic aging and the growing electoral over-participation of seniors.

Reminder: not voting means letting old people (cons|retirees|xenophobes|religious|Luddites) run the country.","['political', 'definition', 'offer', 'Retirees', 'disproportionate']",2016-11-29 09:35:15,"{'neg': 0.0, 'neu': 0.948, 'pos': 0.052, 'compound': 0.4404}",positive
"http://www.ipsos.fr/sites/default/files/attachments/rapport_svv_2012_-_23_avril_2012_-_10h.pdf

18-24 year olds vote quite differently from 25-34 year olds (apart from the green vote being significantly higher than the rest).

18-24 year olds voted badly for Sarkozy (!?). While the 25-34 year olds are the best brackets for Mélenchon and Hollande.","['year', 'olds', '1824', 'vote', '2534']",2016-11-29 10:22:27,"{'neg': 0.064, 'neu': 0.844, 'pos': 0.092, 'compound': 0.3382}",positive
This comment smacks of the guy who believes that all young people vote progressive. My god 2017 is going to be a very bad wake-up call for some.,"['comment', 'smacks', 'guy', 'believes', 'young']",2016-11-29 12:54:22,"{'neg': 0.123, 'neu': 0.809, 'pos': 0.068, 'compound': -0.4005}",negative
You can also be young and Luddite....,"['also', 'young', 'Luddite']",2016-11-29 11:36:35,"{'neg': 0.0, 'neu': 1.0, 'pos': 0.0, 'compound': 0.0}",neutral
And voting means legitimizing Hollandes and Sarkozys. You know I think a lot of abstainers would like to vote... there's just a lack of decent candidates.,"['voting', 'means', 'legitimizing', 'Hollandes', 'Sarkozys']",2016-11-29 10:58:45,"{'neg': 0.089, 'neu': 0.814, 'pos': 0.097, 'compound': 0.0516}",positive
Isn't that already the case? The average age of parliament is probably over 50.,"['Isnt', 'already', 'case', 'average', 'age']",2016-11-29 10:47:21,"{'neg': 0.0, 'neu': 1.0, 'pos': 0.0, 'compound': 0.0}",neutral
"Great, we'll be able to choose which retired xenophobic and religious old bastard will lead our country.","['Great', 'well', 'able', 'choose', 'retired']",2016-11-29 11:00:22,"{'neg': 0.155, 'neu': 0.664, 'pos': 0.181, 'compound': 0.1531}",positive
Politics everywhere in fact.,"['Politics', 'everywhere', 'fact']",2016-11-29 11:16:05,"{'neg': 0.0, 'neu': 1.0, 'pos': 0.0, 'compound': 0.0}",neutral
It is locked by simple voting.,"['locked', 'simple', 'voting']",2016-11-29 17:24:54,"{'neg': 0.0, 'neu': 1.0, 'pos': 0.0, 'compound': 0.0}",neutral
Excellent article. Thanks for sharing OP. It should be required reading for many.,"['Excellent', 'article', 'Thanks', 'sharing', 'OP']",2016-11-29 10:31:41,"{'neg': 0.0, 'neu': 0.515, 'pos': 0.485, 'compound': 0.8555}",positive
"Representative democracy *of the old*

Yes, that seems fair to me.","['Representative', 'democracy', 'old', 'Yes', 'seems']",2016-11-29 10:36:18,"{'neg': 0.0, 'neu': 0.643, 'pos': 0.357, 'compound': 0.6124}",positive
"Again... Well I repeat, too bad for those who are not going to vote. A senior's voice counts as much as any other voice.","['voice', 'Well', 'repeat', 'bad', 'going']",2016-11-29 12:52:46,"{'neg': 0.137, 'neu': 0.781, 'pos': 0.082, 'compound': -0.34}",negative
This is good because it is representative of the planet and ecosystems: only 15 years to live.,"['good', 'representative', 'planet', 'ecosystems', '15']",2016-11-29 11:19:33,"{'neg': 0.0, 'neu': 0.847, 'pos': 0.153, 'compound': 0.4404}",positive
"It all depends, I'm young and I support Fillon and I've always voted for the right since I was 18, the same goes for those around me of the same age.","['depends', 'Im', 'young', 'support', 'Fillon']",2016-11-29 13:50:43,"{'neg': 0.0, 'neu': 0.912, 'pos': 0.088, 'compound': 0.4019}",positive
Isère - Rhône. Livestock truck accident on the A43: the highway closed to traffic,"['Isère', 'Rhône', 'Livestock', 'truck', 'accident']",2023-11-08 08:57:33,"{'neg': 0.205, 'neu': 0.795, 'pos': 0.0, 'compound': -0.4767}",negative
,"['Isère', 'Rhône', 'Livestock', 'truck', 'accident']",2023-11-08 08:57:33,"{'neg': 0.0, 'neu': 0.0, 'pos': 0.0, 'compound': 0.0}",neutral
":(
  
> ### A driver makes a U-turn in the wrong direction and causes an accident
Furthermore, a driver caught in traffic jams did not hesitate to turn around on the motorway when he went up the A432 in the wrong direction, causing a serious accident. One person was treated in absolute emergency.

You have to be stupid though","['driver', 'wrong', 'direction', 'accident', 'makes']",2023-11-08 09:21:07,"{'neg': 0.326, 'neu': 0.648, 'pos': 0.026, 'compound': -0.9627}",negative
"https://www.leprogres.fr/faits-divers-justice/2023/11/08/accident-sur-l-a43-des-bovins-euthanasies-une-personnel-en-urgence-absolue-l-autoroute- cut off

The extent of the damage...","['httpswwwleprogresfrfaitsdiversjustice20231108accidentsurla43desbovinseuthanasiesunepersonnelenurgenceabsoluelautoroute', 'cut', 'extent', 'damage']",2023-11-08 11:10:05,"{'neg': 0.231, 'neu': 0.769, 'pos': 0.0, 'compound': -0.2732}",negative
"Other sources:
https://www.francebleu.fr/infos/faits-divers-justice/nord-isere-l-autoroute-a43-coupee-dans-les-deux-sens-apres-un-accident-3033277
https://www.francetvinfo.fr/economie/transports/trafic/rhone-une-betaillere-se-renverse-sur-l-a43-l-autoroute-coupee-dans-les-deux-sens-sur-21- kilometers_6170943.html","['sources', 'httpswwwfrancebleufrinfosfaitsdiversjusticenordiserelautoroutea43coupeedanslesdeuxsensapresunaccident3033277', 'httpswwwfrancetvinfofreconomietransportstraficrhoneunebetaillereserenversesurla43lautoroutecoupeedanslesdeuxsenssur21', 'kilometers6170943html']",2023-11-08 09:19:32,"{'neg': 0.0, 'neu': 1.0, 'pos': 0.0, 'compound': 0.0}",neutral
"Family planning: anti-trans, “progressive cautions” of the reactions","['Family', 'planning', 'antitrans', '“', 'progressive']",2022-09-08 12:11:15,"{'neg': 0.0, 'neu': 1.0, 'pos': 0.0, 'compound': 0.0}",neutral
,"['Family', 'planning', 'antitrans', '“', 'progressive']",2022-09-08 12:11:15,"{'neg': 0.0, 'neu': 0.0, 'pos': 0.0, 'compound': 0.0}",neutral
"“Dora Moutot woofing with Thierry Casasnovas”

that made me laugh so fucking much it looks like the start of a joke","['“', 'Dora', 'Moutot', 'woofing', 'Thierry']",2022-09-08 14:41:31,"{'neg': 0.0, 'neu': 0.672, 'pos': 0.328, 'compound': 0.8074}",positive
We can't wait to leave trans people alone. If a guy is pregnant 🫄 that's his own business.,"['cant', 'wait', 'leave', 'trans', 'people']",2022-09-08 14:04:15,"{'neg': 0.117, 'neu': 0.816, 'pos': 0.067, 'compound': -0.2148}",negative
Um… how many pregnant men are there in France?,"['Um…', 'many', 'pregnant', 'men', 'France']",2022-09-08 20:32:19,"{'neg': 0.0, 'neu': 1.0, 'pos': 0.0, 'compound': 0.0}",neutral
"Next step: requested maternity leave and the benefits that go with it
There we all pay","['Next', 'step', 'requested', 'maternity', 'leave']",2022-09-08 21:18:41,"{'neg': 0.143, 'neu': 0.714, 'pos': 0.143, 'compound': 0.25}",positive
">According to them, “only women, that is to say adult human females, can be pregnant”. Except that trans men who were born female and transitioned without having their uterus removed can still get pregnant and give birth.

It's funny because Stern/Moutot and Bock say exactly the same thing actually.","['say', 'pregnant', 'According', '“', 'women']",2022-09-08 13:12:30,"{'neg': 0.0, 'neu': 0.943, 'pos': 0.057, 'compound': 0.4404}",positive
"But yes this debate is stupid. Everyone knows that only biological women can give birth. Everyone knows that this includes trans men (except rare borderline cases).

The only subject ultimately is what is a woman, an individual of sex, or of feminine gender?","['Everyone', 'knows', 'yes', 'debate', 'stupid']",2022-09-09 12:12:38,"{'neg': 0.096, 'neu': 0.831, 'pos': 0.074, 'compound': -0.2617}",negative
[removed],['removed'],2022-09-08 13:24:24,"{'neg': 0.0, 'neu': 1.0, 'pos': 0.0, 'compound': 0.0}",neutral
"The question is not about “biological reality”, everyone is aware of that.

It is above all a question of welcoming trans people, a place of medical follow-up must be inclusive so as not to become a repellent for these people who need follow-up like anyone else.","['question', 'people', 'followup', '“', 'biological']",2022-09-08 13:48:29,"{'neg': 0.0, 'neu': 0.884, 'pos': 0.116, 'compound': 0.6597}",positive
"Good morning,

This comment has been deleted. Transphobic comments are not tolerated on this subreddit.

---------------------

This comment has been removed. Transphobia is not tolerated on this subreddit.



The rules for /r/france are [available here](https://www.reddit.com/r/france/wiki/regles). To contest this action, or for any questions, please send a [message to moderators](https://www.reddit.com/message/compose?to=%2Fr%2Ffrance).

Thank you for your understanding.","['comment', 'tolerated', 'subreddit', 'Good', 'morning']",2022-09-08 14:09:18,"{'neg': 0.0, 'neu': 0.867, 'pos': 0.133, 'compound': 0.7717}",positive
"The question is should we favor gender identity or biological gender? yes / no / in which cases?

&#x200B;

I believe that we have not yet decided this question.","['question', 'gender', 'favor', 'identity', 'biological']",2022-09-08 13:35:39,"{'neg': 0.071, 'neu': 0.743, 'pos': 0.186, 'compound': 0.5514}",positive
Who is this “we” who would claim to decide in the place of others whether others have the right to live as he or she sees fit?,"['others', '“', '”', 'would', 'claim']",2022-09-08 19:27:10,"{'neg': 0.0, 'neu': 0.912, 'pos': 0.088, 'compound': 0.3612}",positive
"I know that these threads generally go awry, I'm still trying to express what I understand about this opposition in the hope of receiving clarification:

On the one hand there are the ""terf"" feminists who say, social gender exists and it is an aberration of society that must be eliminated because it comes from relations of domination, particularly that of men on the women. Trans people are therefore enemies because they find themselves in the social gender.

On the other hand, the transidentitists (?) who say, there is no need to question social gender, and this must be separated from biological identity. Terf feminists are enemies because they want to abolish social gender.

The ideological divergence is therefore around social gender. Not about its existence, but about its merits and how to consider it for the future of society. (a bug vs a feature, basically?)","['social', 'gender', 'hand', 'feminists', 'say']",2022-09-08 13:42:05,"{'neg': 0.046, 'neu': 0.88, 'pos': 0.074, 'compound': 0.6497}",positive
"So, to be schematic. Because otherwise, it goes in all directions. And my goal is not to write an academic article on this post.

Already, basically, terfs is an overused term, which was initially used to characterize radical anti-trans feminists. For them, gender, as well as heterosexuality, is a social construct that must be destroyed, because it is what leads to male domination. Additionally, for some terfs, gender is also a social construct. And one of their ways was to live in a female community. As a result, trans women, by changing gender, are seen as colonizers who seek to destroy the female class in order to ensure the survival of patriarchy. And trans men as well as heterosexual trans people are class traitors, because they prevent the destruction of patriarchy and heterosexuality.

Now, the term terfs refers to all women who claim to be feminists, even if they have no ounce of radicalism, like moutout or stern. Stern, moutot, or rowling, it's rather gender and sex are social realities and trans people cannot change sex/gender.

But overall, for terfs, gender change remains a danger for the female class.

On the side of trans people, there are several approaches. There is the innate side, where the gender identity which is innate is different from the sex at birth. There is the queer transfeminism side, close to queer feminism, which considers that sex and gender are social constructions, but that to put an end to patriarchy, it is better to favor the multiplicity of genders/sexes. And there is the transmaterialist side (for France at least) of considering trans people as class defectors, and which analyzes everything against the backdrop of class struggle (men vs. women, trans vs. cis) and on the materiality of body. But actually, the central point is that gender is not always correlated with sex.

Basically, roughly, you have more or less identified the terf and trans ideologies. On the other hand, the divergence is not linked to gender. The divergence lies in whether or not it is possible to change gender/sexual class. Yes for trans people, no for terfs.

So. Ps, I'm trans, which should therefore give an indication of which side of the debate I'm on.","['trans', 'gender', 'class', 'terfs', 'people']",2022-09-08 19:53:31,"{'neg': 0.067, 'neu': 0.875, 'pos': 0.058, 'compound': -0.5346}",negative
"I think we can go further in simplification because even talking about social gender is a somewhat technical term.

&#x200B;

We can say that on the one hand, there are people who consider that physical/material reality is what matters most.

And on the other, people who consider that physical reality is less important than how a person feels.

&#x200B;

So on the one hand, people who think that if you are female, you will always be a woman. And on the other, people who think that the designation “man”/”woman” depends on you.

These are two visions that are completely opposed.","['people', 'think', '”', 'x200B', 'one']",2022-09-08 14:09:12,"{'neg': 0.0, 'neu': 0.893, 'pos': 0.107, 'compound': 0.8363}",positive
">On one side there are the “terf” feminists

So no. Declaring yourself a feminist is not enough to be one. It's like the left, the PS tries to claim it loud and clear but the facts disqualify it.

Terfs are far-right Trojan horses. Like when the FN flirts with the gay electorate under the pretext that Muslims are particularly homophobic. The defense is circumstantial and very self-interested (also very targeted: black or Arab homos are clearly not concerned).

Same thing here since their definition of a woman is completely slammed and deliberately restricted.","['one', 'side', '“', 'terf', '”']",2022-09-08 19:30:00,"{'neg': 0.05, 'neu': 0.808, 'pos': 0.142, 'compound': 0.8126}",positive
Ethics Committee: what is this “thing”?,"['Ethics', 'Committee', '“', 'thing', '”']",2018-09-26 10:21:46,"{'neg': 0.0, 'neu': 1.0, 'pos': 0.0, 'compound': 0.0}",neutral
"The ethics committee said, among other things:

* PMA for all
* GPA for person
* Euthanasia for no one
* Freezing of ovocites possible.

&#x200B;

But who are these people who decide what is morally acceptable or not? Where does their legitimacy come from?

* Who are they ?
* What do they represent?
* Who do they represent?
* Who designates them?
* Are they elected? do they have a mandate? they represent the people? It does not seem like.

&#x200B;

Are they super intelligent to decide on morality for an entire country?

Are these the new priests of modern times who are imposing their morals on us?

Ethics committee ? what ethics? who defines it: a law? a bible?

I'm fed up with these so-called experts who impose their morals on us, following their recommendation so we will make a law or not! Amazing ! What about the people then?

&#x200B;

I find that exaggerated importance is given to this “ethics committee”!

Who are they to decide that I must become a bedridden collapse and not be euthanized if I wish?

Who are they to decide whether or not my wife can *lend* her womb to her sister who has uterine cancer?

&#x200B;

What ethics can decide for us what we have the right to do or not do with our bodies?

How could an expert behind his desk decide that for me?

&#x200B;

I am not sure that the abortion would have been authorized if the opinion of an ethics committee had been sought.... Not at all.

&#x200B;

Why do we talk so little about the legitimacy of this famous ethics committee and what it is based on to “give recommendations” as if it were sacred and their word was worth gold!

&#x200B;

That was my rant of the day!","['Ethics', 'Committee', '“', 'thing', '”']",2018-09-26 10:21:46,"{'neg': 0.105, 'neu': 0.828, 'pos': 0.067, 'compound': -0.8805}",negative
"Well already [the Wikipedia article](https://fr.wikipedia.org/wiki/Comit%C3%A9_consultatif_national_d%27%C3%A9thique) answers a lot of questions and above all you forget the important dead person, it's the word “consultative”. Basically they just give their opinion and the government can say that it wouldn't change anything at all.","['Well', 'already', 'Wikipedia', 'articlehttpsfrwikipediaorgwikiComitC3A9consultatifnationald27C3A9thique', 'answers']",2018-09-26 10:25:53,"{'neg': 0.134, 'neu': 0.781, 'pos': 0.085, 'compound': -0.5106}",negative
"except that the government uses it as a pretext to do or not to do.

Do you think the government is going to launch a debate in the Assembly on GPA or Euthanasia?

surely not.

On the PMA yes...","['government', 'except', 'uses', 'pretext', 'think']",2018-09-26 10:29:18,"{'neg': 0.0, 'neu': 0.925, 'pos': 0.075, 'compound': 0.4404}",positive
Have you ever opened a Wikipedia page in your life?,"['ever', 'opened', 'Wikipedia', 'page', 'life']",2018-09-26 10:27:39,"{'neg': 0.0, 'neu': 1.0, 'pos': 0.0, 'compound': 0.0}",neutral
"It's way too complicated, and you know, there are always trolls on Wikipedia, didn't you listen to your teachers?
Well, it's much cooler to complain on Reddit!","['way', 'complicated', 'know', 'always', 'trolls']",2018-09-26 10:31:39,"{'neg': 0.093, 'neu': 0.836, 'pos': 0.07, 'compound': -0.1759}",negative
"Have you ever thought outside of Wikipedia once in your life?

&#x200B;","['ever', 'thought', 'outside', 'Wikipedia', 'life']",2018-09-26 10:33:18,"{'neg': 0.0, 'neu': 1.0, 'pos': 0.0, 'compound': 0.0}",neutral
"Hello /u/MathLePicard, as you obviously do not intend to do an AMA on the ethics committee but to ask the opinion of other forum users on the subject I took the liberty of modifying the flair in AskFrance.

Good day.","['Hello', 'uMathLePicard', 'obviously', 'intend', 'AMA']",2018-09-26 10:46:31,"{'neg': 0.0, 'neu': 0.814, 'pos': 0.186, 'compound': 0.8573}",positive
"anything... The ""humor"" tag was the best choice...","['anything', 'humor', 'tag', 'best', 'choice']",2018-09-26 11:00:08,"{'neg': 0.0, 'neu': 0.625, 'pos': 0.375, 'compound': 0.6369}",positive
"I thought AMA meant In My Opinion....

So what does AMA mean? what does AskFrance mean?","['AMA', 'mean', 'thought', 'meant', 'Opinion']",2018-09-26 11:35:53,"{'neg': 0.0, 'neu': 1.0, 'pos': 0.0, 'compound': 0.0}",neutral
"He is back.

And he's not happy","['back', 'hes', 'happy']",2018-09-26 10:28:47,"{'neg': 0.333, 'neu': 0.667, 'pos': 0.0, 'compound': -0.4585}",negative
"Libertarian, yes but only if I can decide for others! MathLePicard probably","['Libertarian', 'yes', 'decide', 'others', 'MathLePicard']",2018-09-26 11:40:02,"{'neg': 0.0, 'neu': 0.715, 'pos': 0.285, 'compound': 0.3802}",positive
He wasn't really gone though.,"['wasnt', 'really', 'gone', 'though']",2018-09-26 11:42:35,"{'neg': 0.0, 'neu': 1.0, 'pos': 0.0, 'compound': 0.0}",neutral
"What do you want, Jean, it's hard to make people think...

Really blessed yes yes in front of the priests of modern times.

No thought outside of Wikipedia and above all taking the other person who dares to challenge for an imbecile... a great Reddit classic!

&#x200B;

No sense of analysis. Fed up with the daisies it's fed up with the daisies we can't say...

&#x200B;

When I read the comments I am stunned by so much docility.

&#x200B;

""We are going to put you in an ethics committee which will decide for you what is morally good or bad, then depending on what the ethics committee decides we will make a law to impose it on you. In any case we will not ask you for your opinion""*

&#x200B;

and so far not one who asks the slightest question, who finds the principle strange.....

&#x200B;

we designate people according to what criteria, what morality, what legitimacy, what purpose? we don't know... but hey, as there is something written on Wikipedia, what's the point of wondering, everything is fine, isn't it?","['x200B', 'make', 'people', 'yes', 'Wikipedia']",2018-09-26 10:43:16,"{'neg': 0.05, 'neu': 0.864, 'pos': 0.086, 'compound': 0.7768}",positive
">I'm fed up with these so-called experts

Clearly, it’s better to trust Gégé from the PMU bar next door.","['Im', 'fed', 'socalled', 'experts', 'Clearly']",2018-09-26 10:28:28,"{'neg': 0.0, 'neu': 0.643, 'pos': 0.357, 'compound': 0.836}",positive
"I complete, I'm fed up with these so-called experts and the systematic contempt that certain pedants have for their fellow citizens. Gégé could probably teach you some. Already modesty. But Gégé must not have his opinion to say on what he should do with his body... only modern-day priests have this right.

If we follow your reasoning we could also prohibit Gégé from voting;... it's true for you he is such a jerk at the mu bar... while you... oh you that's not your case... .

Everyone has their own mentality, isn’t that “super-gege”!","['Gégé', 'could', 'complete', 'Im', 'fed']",2018-09-26 10:35:03,"{'neg': 0.059, 'neu': 0.887, 'pos': 0.054, 'compound': -0.1386}",negative
I have my afternoon popcorn topic! Don't pay attention to me 🍿,"['afternoon', 'popcorn', 'topic', 'Dont', 'pay']",2018-09-26 11:28:40,"{'neg': 0.0, 'neu': 0.85, 'pos': 0.15, 'compound': 0.1501}",positive
