Frase,Parole chiave,Data,Sentiment,Sentiment risultato
"Euthanasia: for the Church, “we would cross the red line with active assistance in dying”","['Euthanasia', 'Church', '“', 'would', 'cross']",2022-10-30 10:02:12,"{'neg': 0.0, 'neu': 0.838, 'pos': 0.162, 'compound': 0.4019}",positive
,"['Euthanasia', 'Church', '“', 'would', 'cross']",2022-10-30 10:02:12,"{'neg': 0.0, 'neu': 0.0, 'pos': 0.0, 'compound': 0.0}",neutral
Seen and don’t care ✅,"['Seen', '’', 'care', '✅']",2022-10-30 10:37:48,"{'neg': 0.0, 'neu': 0.484, 'pos': 0.516, 'compound': 0.4939}",positive
"“Thank you for your intervention, we will consider your opinion with all the respect we owe you”","['“', 'Thank', 'intervention', 'consider', 'opinion']",2022-10-30 12:56:00,"{'neg': 0.0, 'neu': 0.838, 'pos': 0.162, 'compound': 0.4767}",positive
r/rienbranler,['rrienbranler'],2022-10-30 17:03:04,"{'neg': 0.0, 'neu': 1.0, 'pos': 0.0, 'compound': 0.0}",neutral
Religion has no place in political life,"['Religion', 'place', 'political', 'life']",2022-10-30 10:31:50,"{'neg': 0.268, 'neu': 0.732, 'pos': 0.0, 'compound': -0.296}",negative
It has no place in the choices of uneducated individuals,"['place', 'choices', 'uneducated', 'individuals']",2022-10-30 11:34:08,"{'neg': 0.196, 'neu': 0.804, 'pos': 0.0, 'compound': -0.296}",negative
Except in Italy unfortunately,"['Except', 'Italy', 'unfortunately']",2022-10-30 17:20:44,"{'neg': 0.444, 'neu': 0.556, 'pos': 0.0, 'compound': -0.34}",negative
"This, we can never say it enough","['never', 'say', 'enough']",2022-10-30 18:22:02,"{'neg': 0.0, 'neu': 1.0, 'pos': 0.0, 'compound': 0.0}",neutral
"Religion is and has always been political: a group of people who have a vision of how we should live, defend their values ​​and recruit and spread the word, it's the same thing as a political party.","['political', 'Religion', 'always', 'group', 'people']",2022-10-31 06:42:55,"{'neg': 0.0, 'neu': 0.807, 'pos': 0.193, 'compound': 0.7506}",positive
You're not ready for the next 15 years then.,"['Youre', 'ready', 'next', '15', 'years']",2022-10-30 17:08:47,"{'neg': 0.209, 'neu': 0.791, 'pos': 0.0, 'compound': -0.2755}",negative
She has no authority but she has her place like everyone else to participate in a complex moral debate.,"['authority', 'place', 'like', 'everyone', 'else']",2022-10-30 14:48:49,"{'neg': 0.076, 'neu': 0.714, 'pos': 0.21, 'compound': 0.4215}",positive
It's all well and good on paper but in reality we are all quick with our convictions and therefore for believers with their religions.,"['well', 'good', 'paper', 'reality', 'quick']",2022-10-30 17:54:29,"{'neg': 0.0, 'neu': 0.863, 'pos': 0.137, 'compound': 0.3612}",positive
"To the extent that some people are believers and that in theory we are in a democracy, religious opinion has its place","['extent', 'people', 'believers', 'theory', 'democracy']",2022-10-30 19:03:58,"{'neg': 0.0, 'neu': 1.0, 'pos': 0.0, 'compound': 0.0}",neutral
The morals of citizens yes. And this morality is often influenced by religion.,"['morals', 'citizens', 'yes', 'morality', 'often']",2022-10-30 12:19:50,"{'neg': 0.0, 'neu': 0.816, 'pos': 0.184, 'compound': 0.4019}",positive
"“Oh, no...

Anyway...""","['“', 'Oh', 'Anyway']",2022-10-30 10:29:42,"{'neg': 0.0, 'neu': 1.0, 'pos': 0.0, 'compound': 0.0}",neutral
"Literally 😂😂😂 Nothing to worry about.

I want to understand that Christian thinking on death strongly influences Western thinking on the subject. So obviously it's an interesting vision among other visions of things and it's interesting to talk about it.

However, I am an atheist (agnostic when I am in a good mood), so death has nothing sacred, suffering from an incurable illness leads to absolutely nothing, being dependent in all your daily tasks is not an life, degenerating neurologically to the vegetable stage is ridiculous because I haven't been here for a while, etc. IN MY OPINION. No one is obligated to share my thoughts. If believers can make sense of this, great.

Nothing legitimizes the incurable and unbearable suffering in my eyes. I don't want to wait for the excruciating suffering at the end before being injected with morphine and then letting myself die of hunger and thirst to finally return my skeletal body to my family.

Ideally, I want to have planned the day a little in advance of the fateful period, experience everything that I can still experience with my beautiful loved ones, then plan a festive day of goodbye, eat well, laugh, say my goodbyes, a big hug to everyone in an atmosphere that has become more solemn, I tell them to celebrate my life not my death, and then I go to a room with the doctors and with the relatives who want to be present, I say a last goodbye and I'm leaving.

It's sad but I don't see the point in letting myself waste away or leaving my family with one last image of me in suffering and deep sadness. No! I was happy to know you, happy to have shared this incensed and absurd moment of existence with you, thank you for everything, I love you, END SCENE. Instead of desperately denying the inevitable. I am going to die, at least let me have an opinion on the circumstances, let me leave with dignity and consciously surrounded by my loved ones.","['want', 'suffering', 'death', 'Nothing', 'thinking']",2022-10-30 11:31:55,"{'neg': 0.128, 'neu': 0.675, 'pos': 0.197, 'compound': 0.9657}",positive
I also don't give a damn about the opinion of the meeting of not anonymous pedophiles on the question of euthanasia,"['also', 'dont', 'give', 'damn', 'opinion']",2022-10-30 10:49:50,"{'neg': 0.0, 'neu': 0.889, 'pos': 0.111, 'compound': 0.3089}",positive
"Astrophysics: for the Church, “we would cross the red line with heliocentrism”.","['Astrophysics', 'Church', '“', 'would', 'cross']",2022-10-30 10:06:22,"{'neg': 0.0, 'neu': 1.0, 'pos': 0.0, 'compound': 0.0}",neutral
Exactly :),['Exactly'],2022-10-30 10:22:35,"{'neg': 0.0, 'neu': 0.25, 'pos': 0.75, 'compound': 0.4588}",positive
"I huffed my nose even though it must be admitted that one of the two subjects relates to the scientific field and the other to ethics/philosophy.
It's not absurd that the church expresses its point of view on morality given that it has been its guardian for thousands of years.
Afterwards, everyone is free to decide whether or not to accept the said opinion.","['huffed', 'nose', 'even', 'though', 'must']",2022-10-30 11:12:08,"{'neg': 0.033, 'neu': 0.897, 'pos': 0.07, 'compound': 0.3645}",positive
"The church has always done this: condemn a practice, then when public opinion is too opposed to it or the opposite is too obvious, make an aggiornamento so as not to be has-been.
(Although I think u/01syd is right on this point)","['church', 'always', 'done', 'condemn', 'practice']",2022-10-30 15:05:56,"{'neg': 0.071, 'neu': 0.929, 'pos': 0.0, 'compound': -0.4588}",negative
"The question would rather be: why does Le Parisien find it legitimate to question the president of the Conference of Bishops of France, aka the head of a religious institution, on the subject? Does he have any authority over civilian life? Psychological, sociological, or ethnological expertise based on the scientific literature in these fields?

If Catholics vote or express themselves on this subject, it will be like everyone else, that is to say as citizens. What a religion thinks about it is irrelevant.","['question', 'subject', 'would', 'rather', 'Le']",2022-10-30 10:08:48,"{'neg': 0.0, 'neu': 0.948, 'pos': 0.052, 'compound': 0.5171}",positive
"I do not understand your question.

There is no need to have any legitimacy to express oneself in the media or to give voice to someone in the media.

“What a religion thinks about it is irrelevant.” No. Not for religious people, you say it yourself, they vote.

'He has any authority over civil life?' Yes... his word counts for Catholics (at least)...","['media', 'understand', 'question', 'need', 'legitimacy']",2022-10-30 13:39:09,"{'neg': 0.069, 'neu': 0.911, 'pos': 0.02, 'compound': -0.4767}",negative
"The Parisian has the right to question whoever he wants, and the priest Machinchouette has the right to have an opinion on the question, and to say it in Le Parisien, since he is asked.

We have the right to judge it not interesting (neither the fact of asking this person, nor the content of their response), and consequently not to buy or read this newspaper.

In fact, it seems to me to be as interesting as the opinion of a table or a chair.","['right', 'question', 'opinion', 'interesting', 'fact']",2022-10-30 10:53:22,"{'neg': 0.053, 'neu': 0.947, 'pos': 0.0, 'compound': -0.5448}",negative
I don't find it so useless. It’s a reminder that religions are damn rubbish.,"['dont', 'find', 'useless', '’', 'reminder']",2022-10-30 13:38:41,"{'neg': 0.387, 'neu': 0.613, 'pos': 0.0, 'compound': -0.7443}",negative
"Being Catholic, I am sorry to tell you that my vote and my political convictions are partly guided by my faith and that I am the only one so yes, what the conference of bishops of France says is of interest.","['Catholic', 'sorry', 'tell', 'vote', 'political']",2022-10-30 10:12:42,"{'neg': 0.029, 'neu': 0.768, 'pos': 0.204, 'compound': 0.8398}",positive
"We clearly understood that they were against it. So if they don't use it, it doesn't matter.
We also don't force her to take assisted reproduction or to marry a guy, nor to divorce, nor to have an abortion.","['dont', 'clearly', 'understood', 'use', 'doesnt']",2022-10-30 10:06:47,"{'neg': 0.027, 'neu': 0.905, 'pos': 0.068, 'compound': 0.3871}",positive
"And GPA too. If you are against it, nothing obliges you to pay a Thai woman, not even a minimum wage, so that she can carry the child you bought for her for 9 months and leave it to her if you don't like it after all.","['GPA', 'nothing', 'obliges', 'pay', 'Thai']",2022-10-30 10:19:47,"{'neg': 0.103, 'neu': 0.897, 'pos': 0.0, 'compound': -0.4039}",negative
"Moral disagreements cannot be resolved simply with ""Are you against it? Don't do it.""","['Moral', 'disagreements', 'resolved', 'simply', 'Dont']",2022-10-30 11:42:45,"{'neg': 0.265, 'neu': 0.735, 'pos': 0.0, 'compound': -0.5136}",negative
"And where are the pedo priests in relation to the red line?

It's not the church that should tell me how to dispose of my carcass.","['pedo', 'priests', 'relation', 'red', 'line']",2022-10-30 11:01:05,"{'neg': 0.0, 'neu': 1.0, 'pos': 0.0, 'compound': 0.0}",neutral
"That has always been recognized as something bad.
 And then we have to stop always coming back to the same argument when we talk about religion.","['always', 'recognized', 'something', 'bad', 'stop']",2022-10-30 11:16:37,"{'neg': 0.263, 'neu': 0.737, 'pos': 0.0, 'compound': -0.802}",negative
"A RIGHT to euthanasia assumes that people will have the RIGHT to resort to euthanasia.

No one will impose it on people who do not wish to be euthanized.

Always busting everyone's balls, religious people.
Are we not supposed to be secular here?
Secularism is freedom of worship, but also being free from the influence of religions.

Add the right to euthanasia to our right so that those who need it for X or Y reason use it.
The others, leave them alone, especially those who draw the red line to euthanasia do not do so to pedophilia.","['euthanasia', 'people', 'RIGHT', 'right', 'assumes']",2022-10-30 14:41:22,"{'neg': 0.083, 'neu': 0.834, 'pos': 0.083, 'compound': 0.4626}",positive
"I was doing an internship in an oncogeriatrics department in Belgium, a patient had chosen euthanasia. She asked to see a priest the day before the act for ""the final anointing"", this did not present any difficulty to the priest.","['priest', 'internship', 'oncogeriatrics', 'department', 'Belgium']",2022-10-30 11:37:01,"{'neg': 0.0, 'neu': 0.946, 'pos': 0.054, 'compound': 0.2584}",positive
Often priests close to believers are much more empathetic to people's suffering than their hierarchy.,"['Often', 'priests', 'close', 'believers', 'much']",2022-10-30 16:39:57,"{'neg': 0.162, 'neu': 0.681, 'pos': 0.157, 'compound': -0.0276}",neutral
"There is often a difference in positioning between the basic priest and the higher authorities, as in many areas.

The fact remains that indeed, in the opinion of the bishops, we have nothing to say about our legislation.","['often', 'difference', 'positioning', 'basic', 'priest']",2022-10-30 16:41:57,"{'neg': 0.0, 'neu': 1.0, 'pos': 0.0, 'compound': 0.0}",neutral
"It is extreme unction, the sacrament of the sick, which aims at the healing of the soul and the body. A priest can give her away in the hope that she will give up her plan.","['give', 'extreme', 'unction', 'sacrament', 'sick']",2022-10-30 12:52:41,"{'neg': 0.084, 'neu': 0.842, 'pos': 0.074, 'compound': -0.1027}",negative
"The Belgians are often socially ahead of us. On LGBTQIA+ rights for example (marriage from 2003, a decade before France).","['Belgians', 'often', 'socially', 'ahead', 'us']",2022-10-30 11:50:36,"{'neg': 0.0, 'neu': 1.0, 'pos': 0.0, 'compound': 0.0}",neutral
"""president of the Conference of Bishops of France""

It's a shame to put this out of the box, it directly indicates that his opinion is of no interest.","['president', 'Conference', 'Bishops', 'France', 'shame']",2022-10-30 10:07:13,"{'neg': 0.164, 'neu': 0.743, 'pos': 0.093, 'compound': -0.3182}",negative
"I don't agree, it's important to put that in the hat, it directly indicates that I don't need to dwell on the article.","['dont', 'agree', 'important', 'put', 'hat']",2022-10-30 13:01:01,"{'neg': 0.22, 'neu': 0.78, 'pos': 0.0, 'compound': -0.4717}",negative
A good number of French people are Catholic. These bishops have an influence on daily life.,"['good', 'number', 'French', 'people', 'Catholic']",2022-10-30 20:50:39,"{'neg': 0.0, 'neu': 0.756, 'pos': 0.244, 'compound': 0.4939}",positive
"They have the right to have an opinion, but they have nothing to impose on us, any more than secularism imposes anything on them. They have the right to suffer a long and painful death, not the right to impose it on me. I remember that in the 1950s, some doctors, no doubt good Christians, performed curettages without anesthesia on women who had had an abortion. The religious do not change.","['right', 'impose', 'opinion', 'nothing', 'us']",2022-10-30 10:58:45,"{'neg': 0.243, 'neu': 0.663, 'pos': 0.094, 'compound': -0.938}",negative
"Yes except we don't care about your imaginary friend.

If you don't want it, no one is forcing you to use it guys.","['dont', 'Yes', 'except', 'care', 'imaginary']",2022-10-30 10:09:38,"{'neg': 0.13, 'neu': 0.607, 'pos': 0.263, 'compound': 0.6044}",positive
Imagine it’s like asking Spiderman cosplayers for an opinion on this question.,"['Imagine', '’', 'like', 'asking', 'Spiderman']",2022-10-30 10:23:05,"{'neg': 0.0, 'neu': 0.815, 'pos': 0.185, 'compound': 0.3612}",positive
"Except that the Catholic Church does not appeal to God to criticize euthanasia, so this is an off-topic remark. I know I'm going to get downvoted for this, but it's the strict truth: we're just attacking ad personam with remarks like this, and blackmail.","['Except', 'Catholic', 'Church', 'appeal', 'God']",2022-10-30 23:06:48,"{'neg': 0.14, 'neu': 0.739, 'pos': 0.121, 'compound': -0.0018}",neutral
Imaginary friend. How are you too subversive to criticize the Catholic religion? You are taking big risks.,"['Imaginary', 'friend', 'subversive', 'criticize', 'Catholic']",2022-10-30 10:21:19,"{'neg': 0.289, 'neu': 0.57, 'pos': 0.14, 'compound': -0.34}",negative
"Fortunately, in theory, in France we have separated the church from the state. Because we would still be in the Middle Ages.","['Fortunately', 'theory', 'France', 'separated', 'church']",2022-10-30 10:16:59,"{'neg': 0.0, 'neu': 1.0, 'pos': 0.0, 'compound': 0.0}",neutral
It's good to know that 90% (and I'm being nice) of the countries in the world are still in the Middle Ages.,"['good', 'know', '90', 'Im', 'nice']",2022-10-30 18:59:14,"{'neg': 0.0, 'neu': 0.879, 'pos': 0.121, 'compound': 0.4404}",positive
England is the Middle Ages?,"['England', 'Middle', 'Ages']",2022-10-30 13:32:54,"{'neg': 0.0, 'neu': 1.0, 'pos': 0.0, 'compound': 0.0}",neutral
"But uhhhhh France is a secular country??? So we don't care about opinions based on each other's religiosity?? Hold a referendum on the subject, take inspiration from all the countries that have implemented the right to euthanasia, and let people decide how they want to die.","['uhhhhh', 'France', 'secular', 'country', 'dont']",2022-10-30 10:18:16,"{'neg': 0.181, 'neu': 0.712, 'pos': 0.108, 'compound': -0.7267}",negative
you don't understand what secularism is. In no case does this imply that “we don’t care about opinions based on religiosity”.,"['dont', 'understand', 'secularism', 'case', 'imply']",2022-10-30 13:34:28,"{'neg': 0.09, 'neu': 0.779, 'pos': 0.131, 'compound': 0.25}",positive
"Ok, thanks for the information. People who practice religion and who perfectly reflect each position in their lifestyles are free to consider that we are crossing a red line. We thank them for not interfering in the lives of others and we respect their choices, should the time come, not to resort to active assistance in dying.","['Ok', 'thanks', 'information', 'People', 'practice']",2022-10-30 13:00:54,"{'neg': 0.0, 'neu': 0.701, 'pos': 0.299, 'compound': 0.9633}",positive
We don't care. Who are you again? It's not Iran here!,"['dont', 'care', 'Iran']",2022-10-30 10:47:10,"{'neg': 0.226, 'neu': 0.774, 'pos': 0.0, 'compound': -0.4442}",negative
"Balek of religion.
I respect believers but a belief should not dictate how to live.","['Balek', 'religion', 'respect', 'believers', 'belief']",2022-10-30 10:23:56,"{'neg': 0.0, 'neu': 0.854, 'pos': 0.146, 'compound': 0.2617}",positive
"Note that the Catholic Church has always been very accommodating of countries that practiced the death penalty. However, in terms of active assistance in dying, that’s where it’s at.","['’', 'Note', 'Catholic', 'Church', 'always']",2022-10-30 11:07:57,"{'neg': 0.194, 'neu': 0.73, 'pos': 0.076, 'compound': -0.6369}",negative
Who cares what the church thinks? Raise your hand !,"['cares', 'church', 'thinks', 'Raise', 'hand']",2022-10-30 12:27:03,"{'neg': 0.0, 'neu': 0.519, 'pos': 0.481, 'compound': 0.7574}",positive
It was really very interesting,"['really', 'interesting']",2022-10-30 10:20:50,"{'neg': 0.0, 'neu': 0.55, 'pos': 0.45, 'compound': 0.5059}",positive
What happens if we cross this famous “red line”? Its a threat ?,"['happens', 'cross', 'famous', '“', 'red']",2022-10-30 10:52:21,"{'neg': 0.273, 'neu': 0.727, 'pos': 0.0, 'compound': -0.5803}",negative
They send you Christine Boutin and she molests you with a flag of the demonstration for all.,"['send', 'Christine', 'Boutin', 'molests', 'flag']",2022-10-30 16:35:58,"{'neg': 0.21, 'neu': 0.718, 'pos': 0.072, 'compound': -0.5719}",negative
"It’s a Russian-style red line. If you cross it, you will be told the next red line.","['red', 'line', '’', 'Russianstyle', 'cross']",2022-10-31 08:12:37,"{'neg': 0.0, 'neu': 1.0, 'pos': 0.0, 'compound': 0.0}",neutral
"For once I took the time to read all the comments to the end. I counted two reasonable ones.

I am appalled that we have reached this level of verbal violence and gratuitous and agreed-upon frontal opposition, although probably no one has read the article due to the paywall.

Still going through the ad-ecclesiam attacks recycled for 60 years (pedophile megnemegne) by the same people who undoubtedly still tolerate uncle-toutouche at the Christmas table and who forget that in the meantime the Church of France has submitted itself to an examination external to which no other Institution has submitted before it (and none after for the moment). There is certainly still a little work to achieve the exemplary quality to which it should be but still...
  
But that we, as a society and in particular as a CSP+ micro-society like Reddit, are so incapable of confronting ideas to try to come up with a synthesis, and that we react to this level of epidermis and bleating sheep, it sincerely saddens me.
 
It is normal that we ask all experts in philosophical doctrines and social models their opinion on a question which goes well beyond the simple selfish act. We ask for the opinion of the president of the CEF, we ask for the opinion of philosophers, we ask for the opinion of caregiver associations, we ask for the opinion of patients, we even ask for the opinion of ordinary citizens drawn from the comes out even though Daniel Martin has absolutely never thought about the question. This is all normal and healthy.

You don't have to agree with this particular opinion (even if in this case you only read the headline and everyone knows that newspaper headlines are always chosen to reflect faithful to the content of the article and more in the opinion of the interviewee/s). But to refuse that someone, a fortiori someone who has the double legitimacy of having thought about the subject and of representing an institution which serves as a benchmark for a few million of our fellow citizens (not counting the fact that he probably accompanied more people at the end of their lives than anyone in the sub), expresses his opinion and that of the institution he represents, it is the beginning of a totalitarian thought which obviously does not shock many people here.
 
I hope that one day we will all be able to take the time to get out of our busy circles to compare our ideas with those of others because there we are going to hit the wall by honking our horns.

Citizenly yours","['opinion', 'ask', 'read', 'people', 'still']",2022-10-30 14:47:15,"{'neg': 0.077, 'neu': 0.865, 'pos': 0.058, 'compound': -0.7673}",negative
Sad too!,['Sad'],2022-10-30 17:26:16,"{'neg': 0.772, 'neu': 0.228, 'pos': 0.0, 'compound': -0.5255}",negative
"Unfortunately I doubt that those concerned will read your post, it would force them to look at themselves and - worse! - to eventually admit that we can dialogue with those who have different opinions, to form a society and to live together. How awful !","['Unfortunately', 'doubt', 'concerned', 'read', 'post']",2022-10-30 16:54:26,"{'neg': 0.235, 'neu': 0.729, 'pos': 0.036, 'compound': -0.8684}",negative
"We can also think that the Church, after 1500 years of systematically harming society, flouting its own morality, violently attacking minorities and seeking to censor any form of opposition, has lost all form of legitimacy with a part of the population. But it's true that it's easier to say that it's just people who are mean and don't like debate.","['form', 'also', 'think', 'Church', '1500']",2022-10-30 17:03:36,"{'neg': 0.182, 'neu': 0.714, 'pos': 0.104, 'compound': -0.3849}",negative
[removed],['removed'],2022-10-30 16:41:01,"{'neg': 0.0, 'neu': 1.0, 'pos': 0.0, 'compound': 0.0}",neutral
Haven't you already crossed the red line when your priests abuse little boys or girls and you turn a blind eye?,"['Havent', 'already', 'crossed', 'red', 'line']",2022-10-30 10:50:29,"{'neg': 0.277, 'neu': 0.723, 'pos': 0.0, 'compound': -0.7845}",negative
Why are we giving them the floor already?,"['giving', 'floor', 'already']",2022-10-30 11:53:41,"{'neg': 0.0, 'neu': 0.745, 'pos': 0.255, 'compound': 0.34}",positive
Except they have no political authority,"['Except', 'political', 'authority']",2022-10-30 18:26:24,"{'neg': 0.293, 'neu': 0.533, 'pos': 0.173, 'compound': -0.2263}",negative
And fortunately !!!,['fortunately'],2022-10-31 10:14:49,"{'neg': 0.0, 'neu': 1.0, 'pos': 0.0, 'compound': 0.0}",neutral
And what color line is endemic pedophilia?,"['color', 'line', 'endemic', 'pedophilia']",2022-10-30 18:50:45,"{'neg': 0.0, 'neu': 1.0, 'pos': 0.0, 'compound': 0.0}",neutral
"Religion has no place in societal decision-making.
What people do with their bodies, and their decision to leave as they wish, is their own business.","['Religion', 'place', 'societal', 'decisionmaking', 'people']",2022-10-30 18:59:15,"{'neg': 0.121, 'neu': 0.783, 'pos': 0.096, 'compound': 0.0772}",positive
"The churches are emptying. It's all about money. I have so many facts in my head. I rub shoulders with priests with my job. It's just a shame. Money. Money again and again

So their morals... The red line is not crossed when we turn a blind eye to pedophilia?? Let people die if they fucking want to!","['Money', 'churches', 'emptying', 'money', 'many']",2022-10-30 22:08:17,"{'neg': 0.191, 'neu': 0.783, 'pos': 0.025, 'compound': -0.8849}",negative
"It's funny, when South American clergy campaign for notorious fascists or prevent raped girls from having abortions, it's not considered ""red lines"" by the Vatican until proven otherwise. Humanity will go nowhere if it does not uphold religious dogmas on all matters of society, ethics and politics.","['funny', 'South', 'American', 'clergy', 'campaign']",2022-10-31 03:11:33,"{'neg': 0.168, 'neu': 0.74, 'pos': 0.092, 'compound': -0.7351}",negative
"""For Éric de Moulins-Beaufort, president of the Conference of Bishops of France (CFE), it is possible to improve the end of life without changing the law, while citizens are currently being drawn to reflect on these questions.""

(sorry for not having access to the content)","['Éric', 'de', 'MoulinsBeaufort', 'president', 'Conference']",2022-10-30 10:02:36,"{'neg': 0.0, 'neu': 0.938, 'pos': 0.062, 'compound': 0.4404}",positive
"If anyone has access to the content, I'm interested, beyond the title and the hat. No offense to some, I am always curious to see what religious representatives think about this type of question (whether or not we believe in their ""imaginary friend"" as some people here still like to call it)","['anyone', 'access', 'content', 'Im', 'interested']",2022-10-30 10:33:56,"{'neg': 0.07, 'neu': 0.751, 'pos': 0.179, 'compound': 0.7579}",positive
